"Coelho-dos-Reis J.G., Peruhype-Magalhães V., Pascoal-Xavier M.A., de Souza Gomes M., do Amaral L.R., Cardoso L.M., Jonathan-Gonçalves J., Ribeiro Á.L., Starling A.L.B., Ribas J.G., Gonçalves D.U., de Freitas Carneiro-Proietti A.B., Teixeira-Carvalho A., Martins-Filho O.A.","57209357925;23135930500;24923416800;26428669600;41261295000;56599947300;57193382425;57193385156;57214539980;7102733315;7005392638;55874075700;15754774600;7004148391;","Flow cytometric-based protocols for assessing anti-MT-2 IgG1 reactivity: High-dimensional data handling to define predictors for clinical follow-up of Human T-cell Leukemia virus type-1 infection",2017,"Journal of Immunological Methods","444",,,"36","46",,2,"10.1016/j.jim.2017.02.006","https://www.scopus.com/inward/record.uri?eid=2-s2.0-85013456495&doi=10.1016%2fj.jim.2017.02.006&partnerID=40&md5=7367163735e76c11a54796407d2ba57e","Grupo Integrado de Pesquisas em Biomarcadores – Centro de Pesquisas René Rachou – FIOCRUZ-Minas, Belo Horizonte, MG, Brazil; Grupo de Pesquisas Clínicas e Políticas Públicas em Doenças Infecciosas e Parasitárias – Centro de Pesquisas René Rachou – FIOCRUZ-Minas, Belo Horizonte, MG, Brazil; Laboratório de Bioinformática e Análise Molecular, Instituto de Genética e Bioquímica/Faculdade de Computação, Patos de Minas, MG, Brazil; Fundação Centro de Hematologia e Hemoterapia de Minas Gerais – HEMOMINAS, Belo Horizonte, MG, Brazil; Programa de Pós-Graduação em Infectologia e Medicina Tropical - Faculdade de Medicina da Universidade Federal de Minas Gerais, Belo Horizonte, MG, Brazil; Hospital Sarah Kubitschek, Belo Horizonte, MG, Brazil","Coelho-dos-Reis, J.G., Grupo Integrado de Pesquisas em Biomarcadores – Centro de Pesquisas René Rachou – FIOCRUZ-Minas, Belo Horizonte, MG, Brazil; Peruhype-Magalhães, V., Grupo Integrado de Pesquisas em Biomarcadores – Centro de Pesquisas René Rachou – FIOCRUZ-Minas, Belo Horizonte, MG, Brazil; Pascoal-Xavier, M.A., Grupo de Pesquisas Clínicas e Políticas Públicas em Doenças Infecciosas e Parasitárias – Centro de Pesquisas René Rachou – FIOCRUZ-Minas, Belo Horizonte, MG, Brazil; de Souza Gomes, M., Laboratório de Bioinformática e Análise Molecular, Instituto de Genética e Bioquímica/Faculdade de Computação, Patos de Minas, MG, Brazil; do Amaral, L.R., Laboratório de Bioinformática e Análise Molecular, Instituto de Genética e Bioquímica/Faculdade de Computação, Patos de Minas, MG, Brazil; Cardoso, L.M., Grupo Integrado de Pesquisas em Biomarcadores – Centro de Pesquisas René Rachou – FIOCRUZ-Minas, Belo Horizonte, MG, Brazil; Jonathan-Gonçalves, J., Grupo Integrado de Pesquisas em Biomarcadores – Centro de Pesquisas René Rachou – FIOCRUZ-Minas, Belo Horizonte, MG, Brazil; Ribeiro, Á.L., Grupo Integrado de Pesquisas em Biomarcadores – Centro de Pesquisas René Rachou – FIOCRUZ-Minas, Belo Horizonte, MG, Brazil; Starling, A.L.B., Fundação Centro de Hematologia e Hemoterapia de Minas Gerais – HEMOMINAS, Belo Horizonte, MG, Brazil, Programa de Pós-Graduação em Infectologia e Medicina Tropical - Faculdade de Medicina da Universidade Federal de Minas Gerais, Belo Horizonte, MG, Brazil; Ribas, J.G., Hospital Sarah Kubitschek, Belo Horizonte, MG, Brazil; Gonçalves, D.U., Programa de Pós-Graduação em Infectologia e Medicina Tropical - Faculdade de Medicina da Universidade Federal de Minas Gerais, Belo Horizonte, MG, Brazil; de Freitas Carneiro-Proietti, A.B., Fundação Centro de Hematologia e Hemoterapia de Minas Gerais – HEMOMINAS, Belo Horizonte, MG, Brazil; Teixeira-Carvalho, A., Grupo Integrado de Pesquisas em Biomarcadores – Centro de Pesquisas René Rachou – FIOCRUZ-Minas, Belo Horizonte, MG, Brazil; Martins-Filho, O.A., Grupo Integrado de Pesquisas em Biomarcadores – Centro de Pesquisas René Rachou – FIOCRUZ-Minas, Belo Horizonte, MG, Brazil","The present work provides an innovative methodological approach to assess the anti-HTLV-1 IgG1 reactivity with practical application in clinical laboratory. Serum from non-infected healthy controls (NI) and HTLV-1-infected patients, categorized as asymptomatic (AS), putatively progressing to HTLV-1 associated myelopathy/tropical spastic paraparesis - HAM/TSP (pHAM) or with clinical diagnosis of HAM/TSP (HT) were assayed in two-parallel flow cytometry platforms, referred as: Fix and Fix&amp;Perm protocols. Operating-characteristics analysis indicated that a single pair of attributes (“serum dilution/cut-off”) for Fix and Fix&amp;Perm protocols presented excellent performance for the diagnosis of HTLV-1 infection. Conversely, Fix and Fix&amp;Perm protocols displayed weak/moderate overall performances when applied with prognosis purposes of HTLV-1 infection. A panoramic snapshot provided by the reactivity boards revealed clearly the higher sensitivity of Fix&amp;Perm protocol for detecting seropositivity for HT, suggesting that stepwise combinatory criteria would improve the global performance of using a single pair of attributes. Three data mining strategies were tested, including endpoint titer analysis, heatmap assemblage and decision tree analysis. Bi-dimensional heatmap analysis demonstrated that, while the clustering profile of NI vs HTLV-1+ revealed segregation in opposite poles, AS vs HT presented discrete segregation but still displaying an intertwined distribution pattern. The combination of methods for segregating AS from HT displayed a moderate but superior global accuracy (85.7%; LOOCV = 71.4%). The comprehensive data analysis support that the combination of methods have improved the performance to the differential diagnosis of AS and HT, with direct association with laboratorial records, including serum cytokine levels and proviral load. © 2017 Elsevier B.V.","Clinical follow-up; Diagnosis; Flow cytometry; HAM/TSP; HTLV-1","gamma interferon; immunoglobulin G1; interleukin 10; tumor necrosis factor; biological marker; cytokine; Human T cell leukemia virus antibody; immunoglobulin G; Article; blood sampling; controlled study; diagnostic test accuracy study; flow cytometry; follow up; HTLV-1 infection; human; major clinical study; priority journal; prognosis; protein blood level; receiver operating characteristic; sensitivity and specificity; algorithm; asymptomatic disease; blood; case control study; cell line; cluster analysis; data mining; decision tree; differential diagnosis; disease course; high throughput screening; HTLV-I Infections; Human T-lymphotropic virus 1; immunology; indirect fluorescent antibody technique; Paraparesis, Tropical Spastic; predictive value; procedures; reproducibility; time factor; virology; virus load; Algorithms; Asymptomatic Diseases; Biomarkers; Case-Control Studies; Cell Line; Cluster Analysis; Cytokines; Data Mining; Decision Trees; Deltaretrovirus Antibodies; Diagnosis, Differential; Disease Progression; Flow Cytometry; Fluorescent Antibody Technique, Indirect; High-Throughput Screening Assays; HTLV-I Infections; Human T-lymphotropic virus 1; Humans; Immunoglobulin G; Paraparesis, Tropical Spastic; Predictive Value of Tests; Reproducibility of Results; Time Factors; Viral Load","Coelho-dos-Reis, J.G.Av. Augusto de Lima, 1715, Barro Preto, Brazil; email: jordana.reis@cpqrr.fiocruz.br",,"Elsevier B.V.",00221759,,JIMMB,"28212879","English","J. Immunol. Methods",Article,"Final",,Scopus,2-s2.0-85013456495
"Becker K., Moreira V.P., dos Santos A.G.L.","7401802524;15769964500;57193268024;","Multilingual emotion classification using supervised learning: Comparative experiments",2017,"Information Processing and Management","53","3",,"684","704",,10,"10.1016/j.ipm.2016.12.008","https://www.scopus.com/inward/record.uri?eid=2-s2.0-85012236166&doi=10.1016%2fj.ipm.2016.12.008&partnerID=40&md5=d60d4c5c955e853cb257c04d8b1b70ee","Institute of Informatics, Universidade Federal do Rio Grande do Sul, Porto Alegre – RS, Brazil","Becker, K., Institute of Informatics, Universidade Federal do Rio Grande do Sul, Porto Alegre – RS, Brazil; Moreira, V.P., Institute of Informatics, Universidade Federal do Rio Grande do Sul, Porto Alegre – RS, Brazil; dos Santos, A.G.L., Institute of Informatics, Universidade Federal do Rio Grande do Sul, Porto Alegre – RS, Brazil","The importance of emotion mining is acknowledged in a wide range of new applications, thus broadening the potential market already proven for opinion mining. However, the lack of resources for languages other than English is even more critical for emotion mining. In this article, we investigate whether Multilingual Sentiment Analysis delivers reliable and effective results when applied to emotions. For this purpose, we developed experiments involving machine translations over corpora originally written in two languages. Our experimental framework for emotion classification assesses variations on (i) the language of the original text and its translations; (ii) strategies to combine multiple languages to overcome losses due to translation; (iii) options for data pre-processing (tokenization, feature representation and feature selection); and (iv) classification algorithms, including meta-classifiers. The results show that emotion classification performance improve significantly with the use of texts in multiple languages, particularly by adopting a stacking of weak monolingual classifiers. Our study also sheds light into the impacts of data preparation strategies and their combination with classification algorithms, and compares differences between polarity and emotion classification according to the same experimental settings. © 2017 Elsevier Ltd","Emotion mining; Multilingual sentiment analysis; Sentiment analysis","Classification (of information); Data handling; Data mining; Translation (languages); Classification algorithm; Comparative experiments; Data preprocessing; Emotion classification; Feature representation; Machine translations; Multiple languages; Sentiment analysis; Text processing","Becker, K.; Institute of Informatics, Universidade Federal do Rio Grande do Sul, Porto Alegre – RS, Brazil; email: karin.becker@inf.ufrgs.br",,"Elsevier Ltd",03064573,,IPMAD,,"English","Inf. Process. Manage.",Article,"Final",,Scopus,2-s2.0-85012236166
"Menezes E.G., Coelho-dos-Reis J.G.A., Cardoso L.M., Lopes-Ribeiro Á., Jonathan-Gonçalves J., Porto Gonçalves M.T., Cambraia R.D., Soares E.B., Silva L.D., Peruhype-Magalhães V., Rios M., Chancey C., Teixeira-Carvalho A., Martins-Filho O.A., Teixeira R.","16042902300;7202197615;56599947300;57212980138;57193382425;57199717443;56042646500;57193134634;57208997052;23135930500;54965352500;16745325200;15754774600;7004148391;7005911479;","Strategies for serum chemokine/cytokine assessment as biomarkers of therapeutic response in HCV patients as a prototype to monitor immunotherapy of infectious diseases",2017,"Antiviral Research","141",,,"19","28",,4,"10.1016/j.antiviral.2017.02.001","https://www.scopus.com/inward/record.uri?eid=2-s2.0-85012875234&doi=10.1016%2fj.antiviral.2017.02.001&partnerID=40&md5=fbbfdc4b667723f0489851af7541d047","Pós-graduação em Ciências Aplicadas à Saúde do Adulto, Faculdade de Medicina, Universidade Federal de Minas Gerais, Belo Horizonte, Minas Gerais, Brazil; Ambulatório de Hepatites Virais, Instituto Alfa de Gastroenterologia, Hospital das Clínicas/UFMG, Belo Horizonte, Minas Gerais, Brazil; Grupo Integrado de Pesquisa em Biomarcadores, Centro de Pesquisas René Rachou, Fundação Oswaldo Cruz, Belo Horizonte, Minas Gerais, Brazil; Departamento de Clínica Médica, Faculdade de Medicina, Universidade Federal de Minas Gerais, Belo Horizonte, Minas Gerais, Brazil; Center for Biologics and Evaluation Research – US Food and Drug Administration, Silver Spring, MD, United States","Menezes, E.G., Pós-graduação em Ciências Aplicadas à Saúde do Adulto, Faculdade de Medicina, Universidade Federal de Minas Gerais, Belo Horizonte, Minas Gerais, Brazil, Ambulatório de Hepatites Virais, Instituto Alfa de Gastroenterologia, Hospital das Clínicas/UFMG, Belo Horizonte, Minas Gerais, Brazil; Coelho-dos-Reis, J.G.A., Grupo Integrado de Pesquisa em Biomarcadores, Centro de Pesquisas René Rachou, Fundação Oswaldo Cruz, Belo Horizonte, Minas Gerais, Brazil; Cardoso, L.M., Grupo Integrado de Pesquisa em Biomarcadores, Centro de Pesquisas René Rachou, Fundação Oswaldo Cruz, Belo Horizonte, Minas Gerais, Brazil; Lopes-Ribeiro, Á., Grupo Integrado de Pesquisa em Biomarcadores, Centro de Pesquisas René Rachou, Fundação Oswaldo Cruz, Belo Horizonte, Minas Gerais, Brazil; Jonathan-Gonçalves, J., Grupo Integrado de Pesquisa em Biomarcadores, Centro de Pesquisas René Rachou, Fundação Oswaldo Cruz, Belo Horizonte, Minas Gerais, Brazil; Porto Gonçalves, M.T., Grupo Integrado de Pesquisa em Biomarcadores, Centro de Pesquisas René Rachou, Fundação Oswaldo Cruz, Belo Horizonte, Minas Gerais, Brazil; Cambraia, R.D., Ambulatório de Hepatites Virais, Instituto Alfa de Gastroenterologia, Hospital das Clínicas/UFMG, Belo Horizonte, Minas Gerais, Brazil; Soares, E.B., Ambulatório de Hepatites Virais, Instituto Alfa de Gastroenterologia, Hospital das Clínicas/UFMG, Belo Horizonte, Minas Gerais, Brazil; Silva, L.D., Pós-graduação em Ciências Aplicadas à Saúde do Adulto, Faculdade de Medicina, Universidade Federal de Minas Gerais, Belo Horizonte, Minas Gerais, Brazil, Ambulatório de Hepatites Virais, Instituto Alfa de Gastroenterologia, Hospital das Clínicas/UFMG, Belo Horizonte, Minas Gerais, Brazil, Departamento de Clínica Médica, Faculdade de Medicina, Universidade Federal de Minas Gerais, Belo Horizonte, Minas Gerais, Brazil; Peruhype-Magalhães, V., Grupo Integrado de Pesquisa em Biomarcadores, Centro de Pesquisas René Rachou, Fundação Oswaldo Cruz, Belo Horizonte, Minas Gerais, Brazil; Rios, M., Center for Biologics and Evaluation Research – US Food and Drug Administration, Silver Spring, MD, United States; Chancey, C., Center for Biologics and Evaluation Research – US Food and Drug Administration, Silver Spring, MD, United States; Teixeira-Carvalho, A., Grupo Integrado de Pesquisa em Biomarcadores, Centro de Pesquisas René Rachou, Fundação Oswaldo Cruz, Belo Horizonte, Minas Gerais, Brazil; Martins-Filho, O.A., Grupo Integrado de Pesquisa em Biomarcadores, Centro de Pesquisas René Rachou, Fundação Oswaldo Cruz, Belo Horizonte, Minas Gerais, Brazil; Teixeira, R., Pós-graduação em Ciências Aplicadas à Saúde do Adulto, Faculdade de Medicina, Universidade Federal de Minas Gerais, Belo Horizonte, Minas Gerais, Brazil, Ambulatório de Hepatites Virais, Instituto Alfa de Gastroenterologia, Hospital das Clínicas/UFMG, Belo Horizonte, Minas Gerais, Brazil, Departamento de Clínica Médica, Faculdade de Medicina, Universidade Federal de Minas Gerais, Belo Horizonte, Minas Gerais, Brazil","In this study, strategies for serum biomarker assessment were developed for therapeutic monitoring of HCV patients. For this purpose, serum chemokine/cytokine levels were measured by cytometric-bead-array in HCV patients, categorized according to immunotherapy response as: non-responder/NR, relapser/REL and sustained-virologic-responder/SVR. The results demonstrated an overall increase of serum chemokine/cytokine levels in HCV patients. In general, therapeutic failure was associated with presence of a predominant baseline proinflammatory pattern with enhanced CCL5/RANTES, IFN-α, IFN-γ along with decreased IL-10 levels in NR and increased IL-6 and TNF in REL. SVR displayed lower baseline proinflammatory status with decreased CXCL8/IL-8, IL-12 and IL-17 levels. The inability to uphold IFN-α levels during immunotherapy was characteristic of NR. Serum chemokine/cytokine signatures further support the deleterious effect of proinflammatory baseline status and the critical role of increased/persistent IFN-α levels to guarantee the sustained virologic response. The prominent baseline proinflammatory milieu observed in NR and REL yielded a restricted biomarker network with small number of neighborhood connections, whereas SVR displayed a network with integrated cytokine connectivity. Noteworthy was that SVR presented a shift towards a proinflammatory pattern upon immunotherapy, assuming a pattern similar to that observed in NR and REL at baseline. Moreover, the immunotherapy guided REL towards a profile similar to SVR at baseline. Analysis of baseline-fold changes during treatment pointed out IFN-α and TNF as high-performance biomarkers to monitor immunotherapy outcome. This knowledge may contribute for novel insights into the treatment and control of the continuous public health threat posed by HCV infection worldwide. © 2017 Elsevier B.V.","Biomarkers; Chemokines; Cytokines; HCV; IFN-α","alanine aminotransferase; alpha interferon; aspartate aminotransferase; biological marker; CXCL9 chemokine; cytokine; gamma interferon; gamma interferon inducible protein 10; interleukin 10; interleukin 12; interleukin 17; interleukin 1beta; interleukin 4; interleukin 6; interleukin 8; monocyte chemotactic protein 1; peginterferon alpha2a; peginterferon alpha2b; RANTES; ribavirin; tumor necrosis factor; alpha interferon; antivirus agent; chemokine; cytokine; IL8 protein, human; interleukin 12; interleukin 17; interleukin 8; macrogol derivative; peginterferon alpha2b; pharmacological biomarker; recombinant protein; adult; aged; antiviral therapy; Article; blood analysis; controlled study; data mining; decision tree; female; flow cytometry; follow up; hepatitis C; Hepatitis C virus genotype 1; human; immunotherapy; longitudinal study; major clinical study; male; nonhuman; parallel design; priority journal; protein blood level; sustained virologic response; systems biology; treatment response; virus load; blood; chronic hepatitis C; drug effects; drug monitoring; immunotherapy; middle aged; procedures; young adult; Adult; Aged; Antiviral Agents; Biomarkers, Pharmacological; Chemokines; Cytokines; Drug Monitoring; Female; Hepatitis C, Chronic; Humans; Immunotherapy; Interferon-alpha; Interleukin-12; Interleukin-17; Interleukin-8; Male; Middle Aged; Polyethylene Glycols; Recombinant Proteins; Viral Load; Young Adult","Teixeira-Carvalho, A.; Grupo Integrado de Pesquisa em Biomarcadores, Centro de Pesquisas René Rachou, FIOCRUZ/MG, Av. Augusto de Lima 1715, Barro Preto, Brazil; email: andreat@cpqrr.fiocruz.br",,"Elsevier B.V.",01663542,,ARSRD,"28163109","English","Antiviral Res.",Article,"Final",Open Access,Scopus,2-s2.0-85012875234
"Carvalho V.A., Almeida J.P.A., Fonseca C.M., Guizzardi G.","57021111200;19933751900;56564887800;16028392500;","Multi-level ontology-based conceptual modeling",2017,"Data and Knowledge Engineering","109",,,"3","24",,20,"10.1016/j.datak.2017.03.002","https://www.scopus.com/inward/record.uri?eid=2-s2.0-85018328902&doi=10.1016%2fj.datak.2017.03.002&partnerID=40&md5=aa3bd672e051dc24ffa801ab6b7afcd4","Ontology & Conceptual Modeling Research Group (NEMO) Federal University of Espírito Santo (UFES), Vitória, ES, Brazil; Research Group in Applied Informatics, Informatics Department, Federal Institute of Espírito Santo (IFES), Colatina, ES, Brazil; Faculty of Computer Science, Free University of Bozen-Bolzano, Italy","Carvalho, V.A., Ontology & Conceptual Modeling Research Group (NEMO) Federal University of Espírito Santo (UFES), Vitória, ES, Brazil, Research Group in Applied Informatics, Informatics Department, Federal Institute of Espírito Santo (IFES), Colatina, ES, Brazil; Almeida, J.P.A., Ontology & Conceptual Modeling Research Group (NEMO) Federal University of Espírito Santo (UFES), Vitória, ES, Brazil; Fonseca, C.M., Ontology & Conceptual Modeling Research Group (NEMO) Federal University of Espírito Santo (UFES), Vitória, ES, Brazil; Guizzardi, G., Ontology & Conceptual Modeling Research Group (NEMO) Federal University of Espírito Santo (UFES), Vitória, ES, Brazil, Faculty of Computer Science, Free University of Bozen-Bolzano, Italy","Since the late 1980s, there has been a growing interest in the use of foundational ontologies to provide a sound theoretical basis for the discipline of conceptual modeling. This has led to the development of ontology-based conceptual modeling techniques whose modeling primitives reflect the conceptual categories defined in a foundational ontology. The ontology-based conceptual modeling language OntoUML, for example, incorporates the distinctions underlying the taxonomy of types in the Unified Foundational Ontology (UFO) (e.g., kinds, phases, roles, mixins, etc.). This approach has focused so far on the support to types whose instances are individuals in the subject domain, with no provision for types of types (or categories of categories). In this paper we address this limitation by extending the Unified Foundational Ontology with the MLT multi-level theory. The UFO-MLT combination serves as a foundation for conceptual models that can benefit from the ontological distinctions of UFO as well as MLT's basic concepts and patterns for multi-level modeling. We discuss the impact of the extended foundation to multi-level conceptual modeling. © 2017 Elsevier B.V.","Conceptual modeling; Multi-level modeling; Ontology","Data mining; Ontology; Unified Modeling Language; Basic concepts; Conceptual model; Conceptual modeling languages; Foundational ontologies; Multilevel model; Multilevels; Ontology-based; Unified foundational ontologies (UFO); Modeling languages","Carvalho, V.A.; Ontology & Conceptual Modeling Research Group (NEMO) Federal University of Espírito Santo (UFES)Brazil; email: victorio@ifes.edu.br",,"Elsevier B.V.",0169023X,,DKENE,,"English","Data Knowl Eng",Article,"Final",,Scopus,2-s2.0-85018328902
"Ribeiro C.E., Brito L.H.S., Nobre C.N., Freitas A.A., Zárate L.E.","57193933303;57193929431;7004027375;55490514300;6603853028;","A revision and analysis of the comprehensiveness of the main longitudinal studies of human aging for data mining research",2017,"Wiley Interdisciplinary Reviews: Data Mining and Knowledge Discovery","7","3", e1202,"","",,5,"10.1002/widm.1202","https://www.scopus.com/inward/record.uri?eid=2-s2.0-85017552736&doi=10.1002%2fwidm.1202&partnerID=40&md5=69a54f1946eb5802c09dd1453e4be799","Departamento de Informática, Pontifícia Universidade Católica de Minas Gerais, Belo Horizonte, Brazil; School of Computing, University of Kent, Canterbury, United Kingdom","Ribeiro, C.E., Departamento de Informática, Pontifícia Universidade Católica de Minas Gerais, Belo Horizonte, Brazil; Brito, L.H.S., Departamento de Informática, Pontifícia Universidade Católica de Minas Gerais, Belo Horizonte, Brazil; Nobre, C.N., Departamento de Informática, Pontifícia Universidade Católica de Minas Gerais, Belo Horizonte, Brazil; Freitas, A.A., School of Computing, University of Kent, Canterbury, United Kingdom; Zárate, L.E., Departamento de Informática, Pontifícia Universidade Católica de Minas Gerais, Belo Horizonte, Brazil","Human aging is a global problem that will have a large socioeconomic impact. A better understanding of aging can direct public policies that minimize its negative effects in the future. Over many years, several longitudinal studies of human aging have been conducted aiming to comprehend the phenomenon, and various factors influencing human aging are under analysis. In this review, we categorize the main aspects affecting human aging into a taxonomy for assisting data mining (DM) research on this topic. We also present tables summarizing the main characteristics of 64 research articles using data from aging-related longitudinal studies, in terms of the aging-related aspects analyzed, the main data analysis techniques used, and the specific longitudinal database mined in each article. Finally, we analyze the comprehensiveness of the main databases of longitudinal studies of human aging worldwide, regarding which proportion of the proposed taxonomy's aspects are covered by each longitudinal database. We observed that most articles analyzing such data use classical (parametric, linear) statistical techniques, with little use of more modern (nonparametric, nonlinear) DM methods for analyzing longitudinal databases of human aging. We hope that this article will contribute to DM research in two ways: first, by drawing attention to the important problem of global aging and the free availability of several longitudinal databases of human aging; second, by providing useful information to make research design choices about mining such data, e.g., which longitudinal study and which types of aging-related aspects should be analyzed, depending on the research's goals. WIREs Data Mining Knowl Discov 2017, 7:e1202. doi: 10.1002/widm.1202. For further resources related to this article, please visit the WIREs website. © 2017 John Wiley & Sons, Ltd",,"Database systems; Taxonomies; Data analysis techniques; Global problems; Human aging; Longitudinal study; Non-parametric; Research designs; Socio-economic impacts; Statistical techniques; Data mining","Ribeiro, C.E.; Departamento de Informática, Pontifícia Universidade Católica de Minas GeraisBrazil; email: caioedurib@gmail.com",,"Wiley-Blackwell",19424787,,,,"English","Wiley Interdiscip. Rev. Data Min. Knowl. Discov.",Review,"Final",,Scopus,2-s2.0-85017552736
