"Bilynkievycz Dos Santos C., Pedroso B., Margarete Guimarães A., Ribeiro Carvalho D., Alberto Pilatti L.","57195560803;35769914100;57195555364;57195558764;57195559974;","Forecasting of Human Development Index of Latin American Countries Through Data Mining Techniques",2017,"IEEE Latin America Transactions","15","9", 8015082,"1747","1753",,2,"10.1109/TLA.2017.8015082","https://www.scopus.com/inward/record.uri?eid=2-s2.0-85028776782&doi=10.1109%2fTLA.2017.8015082&partnerID=40&md5=5727e8e5bcf59ce0e28b330226f432f6","UEPG, UTFPR, Brazil; UEPG, Brazil; PUC-PR, Brazil; UTFPR, Brazil","Bilynkievycz Dos Santos, C., UEPG, UTFPR, Brazil; Pedroso, B., UEPG, Brazil; Margarete Guimarães, A., UEPG, Brazil; Ribeiro Carvalho, D., PUC-PR, Brazil; Alberto Pilatti, L., UTFPR, Brazil","Aim: Predict the Human Development Index (HDI) of 2013 and 2014 of Latin American countries through forecast data mining techniques. Methodology: Full stages of Knowledge Discovery in Databases applied in univariate and multivariate time series. For the prediction, the predicting abilities of 90 predicting models were tested, distributed in two global multivariate, 44 specific multivariate per country and 44 univariate. The algorithm SMOReg was adopted in the development of models as it presented a better performance among the learning algorithms based on functions tested in the experiment. Results: It was observed that the predictions of the models did not present significant statistical differences from the HDI tendencies disclosed in the last report of the United Nations Development Program. Nevertheless, the global multivariate models presented better quality measures in the predictions. Conclusion: The HDI prediction models used with multivariate time series provide better learning of algorithms with the increase of different univariate historical experiences. © 2003-2012 IEEE.","Data mining; Forecasting; HDI; Latin America; Time Series","Data mining; Learning algorithms; Time series; Historical experience; Human development index; Knowledge discovery in database; Latin America; Multivariate models; Multivariate time series; Statistical differences; United nations development programs; Forecasting",,,"IEEE Computer Society",15480992,,,,"Portuguese","IEEE. Lat. Am. Trans.",Article,"Final",,Scopus,2-s2.0-85028776782
"Júnior S.M., de Oliveira J.","57203430039;55193805700;","Comparative study on data mining techniques applied to breast cancer gene expression profiles",2017,"BIOINFORMATICS 2017 - 8th International Conference on Bioinformatics Models, Methods and Algorithms, Proceedings; Part of 10th International Joint Conference on Biomedical Engineering Systems and Technologies, BIOSTEC 2017","3",,,"168","175",,,"10.5220/0006170201680175","https://www.scopus.com/inward/record.uri?eid=2-s2.0-85051742840&doi=10.5220%2f0006170201680175&partnerID=40&md5=d268f7d32c65d112c563ed807be847e6","School of Sciences, Humanities and Languages, São Paulo State University, Av. Dom Antonio, Assis - SP, 2100, Brazil; Uppsala University, Uppsala, Sweden","Júnior, S.M., School of Sciences, Humanities and Languages, São Paulo State University, Av. Dom Antonio, Assis - SP, 2100, Brazil, Uppsala University, Uppsala, Sweden; de Oliveira, J., School of Sciences, Humanities and Languages, São Paulo State University, Av. Dom Antonio, Assis - SP, 2100, Brazil","Breast cancer has the second highest incidence among all cancer types and is the fifth cause of cancer related death among women. In Brazil, breast cancer mortality rates have been rising. Cancer classification is intricate, mainly when differentiating subtypes. In this context, data mining becomes a fundamental tool to analyze genotypic data, improving diagnostics, treatment and patient care. As the data dimensionality is problematic, methods to reduce it must be applied. Hence, the present study aims at the analysis of two data mining methods (i.e., decision trees and artificial neural networks). Weka® and MATLAB® were used to implement these two methodologies. Decision trees appointed important genes for the classification. Optimal artificial neural network architecture consists of two layers, one with 99 neurons and the other with 5. Both data mining techniques were able to classify data with high accuracy. Copyright © 2017 by SCITEPRESS – Science and Technology Publications, Lda. All rights reserved.","Artificial Neural Networks; Breast Cancer; Data Mining; Decision Trees","Bioinformatics; Biomedical engineering; Classification (of information); Decision trees; Diseases; Forestry; Gene expression; Multilayer neural networks; Network architecture; Patient treatment; Trees (mathematics); Breast Cancer; Cancer classification; Comparative studies; Data dimensionality; Data mining methods; Fundamental tools; High-accuracy; Patient care; Data mining",,"Ali H.Fred A.Gamboa H.Vaz M.","SciTePress",,9789897582141,,,"English","BIOINFORMATICS - Int. Conf. Bioinform. Models, Methods Algorithms, Proc.; Part Int. Jt. Conf. Biomed. Eng. Syst. Technol., BIOSTEC",Conference Paper,"Final",,Scopus,2-s2.0-85051742840
"Farias E.C., Schünke M.A., Da Silva P.R.P., Zeve C.M.D.","57200419028;57193128233;7102059445;57200416105;","Application of data mining techniques on olympic data",2017,"Proceedings of the International Conference on WWW/Internet 2017 and Applied Computing 2017",,,,"245","250",,,,"https://www.scopus.com/inward/record.uri?eid=2-s2.0-85041197655&partnerID=40&md5=cd4432e64dc18c5d608a39d3e5717494","Universidade Luterana Do Brasil (Ulbra), Curso de Ciencia da Computacao-Campus, Guaíba, Brazil; Universidade Luterana Do Brasil (Ulbra), Curso de Educacao Física - Campus, Guaíba, Brazil","Farias, E.C., Universidade Luterana Do Brasil (Ulbra), Curso de Ciencia da Computacao-Campus, Guaíba, Brazil; Schünke, M.A., Universidade Luterana Do Brasil (Ulbra), Curso de Ciencia da Computacao-Campus, Guaíba, Brazil; Da Silva, P.R.P., Universidade Luterana Do Brasil (Ulbra), Curso de Educacao Física - Campus, Guaíba, Brazil; Zeve, C.M.D., Universidade Luterana Do Brasil (Ulbra), Curso de Ciencia da Computacao-Campus, Guaíba, Brazil","This work seeks to explore the current scenario of news related to the Olympic Games of Rio de Janeiro 2016, using the process of knowledge discovery in databases. With the increase of the news divulged in the scope of the olympic sports, it is tried to relate the most diverse adjacent subjects like Olympic with its games in its totality and with this to identify patterns and relations for the vision of the producers of the content in the disclosure of news on games Olympic. The motivation of this analysis is to be able to understand what the current scenario of news related to the Olympics, how much access to this content in relation to the other inserted in the page, which is the content of these publications about each of the related Issues and who is the producer of this content, which feeling about the content and interest in the interrelation of these issues. © 2017.","Data Mining; Knowledge Discovery; Olympic Games","Computer programming; Computer science; Knowledge discovery in database; Olympic games; Olympics; Data mining",,"Weghorn H.Isaias P.Rodrigues L.","IADIS Press",,9789898533692,,,"English","Proc. Int. Conf. WWW/Internet Appl. Comput.",Conference Paper,"Final",,Scopus,2-s2.0-85041197655
"Lopes R.G., Ladeira M., Carvalho R.N.","57193643504;57215425602;24483285100;","Use of machine learning techniques in the prediction of credit recovery",2017,"Advances in Science, Technology and Engineering Systems","2","3",,"1432","1442",,1,"10.25046/aj0203179","https://www.scopus.com/inward/record.uri?eid=2-s2.0-85069159554&doi=10.25046%2faj0203179&partnerID=40&md5=5c8372e9c6693f60f9554de2f8c4f9d2","Bank of Brazil, IT Department, Brazil; University of Brasilia, Department of Computer Science, Brasilia, Brazil","Lopes, R.G., Bank of Brazil, IT Department, Brazil; Ladeira, M., University of Brasilia, Department of Computer Science, Brasilia, Brazil; Carvalho, R.N., University of Brasilia, Department of Computer Science, Brasilia, Brazil","This paper is an extended version of the paper originally presented at the International Conference on Machine Learning and Applications (ICMLA 2016), which proposes the construction of classifiers, based on the application of machine learning techniques, to identify defaulting clients with credit recovery potential. The study was carried out in 3 segments of a Bank's operations and achieved excellent results. Generalized linear modeling algorithms (GLM), distributed random forest algorithms (DRF), deep learning (DL) and gradient expansion algorithms (GBM) implemented on the H2O.ai platform were used. © 2017 ASTES Publishers. All rights reserved.","Credit recovery; Data mining; H2o.ai; Machine learning",,"Lopes, R.G.; Bank of Brazil, IT DepartmentBrazil; email: rglopes@bb.com.br",,"ASTES Publishers",24156698,,,,"English","Adv. Sci., Technol. Eng. Syst.",Article,"Final",Open Access,Scopus,2-s2.0-85069159554
"Santos F.P., Silveira I.F., Lechugo C.P.","57193428176;7003305114;57192553660;","Analysis of the perception of students about the teacher's practices through educational data mining [Análise da percepção dos alunos sobre as práticas docentes por meio da mineração de dados educacionais]",2017,"Espacios","38","5",,"9","",,2,,"https://www.scopus.com/inward/record.uri?eid=2-s2.0-85013824408&partnerID=40&md5=784c6c25fd5e0d25a49b664708de2978","Universidade Mackenzie, SP, Brazil; Universidade de Sorocaba, SP, Brazil; HAMK University of Applied Science, Finland; UFF, RJ, Brazil; FGV, RJ, Brazil; Univ. São Judas Tadeu, SP, Brazil; Academia de Ensino Superior, SP, Brazil; Instituto Federal de São Paulo, SP, Brazil; Centro Paula Souza, SP, Brazil; Universidade Federal de Juiz de Fora, MG, Brazil; Instituto Tecnológico de Aeronáutica, SP, Brazil; Universidade de São Paulo, SP, Brazil; Universidade Presbiteriana Mackenzie, SP, Brazil; Universidade Cruzeiro do Sul, SP, Brazil","Santos, F.P., Universidade Mackenzie, SP, Brazil, Universidade de Sorocaba, SP, Brazil, HAMK University of Applied Science, Finland, UFF, RJ, Brazil, FGV, RJ, Brazil, Univ. São Judas Tadeu, SP, Brazil, Academia de Ensino Superior, SP, Brazil, Instituto Federal de São Paulo, SP, Brazil, Centro Paula Souza, SP, Brazil; Silveira, I.F., Universidade Federal de Juiz de Fora, MG, Brazil, Instituto Tecnológico de Aeronáutica, SP, Brazil, Universidade de São Paulo, SP, Brazil, Universidade Presbiteriana Mackenzie, SP, Brazil, Universidade Cruzeiro do Sul, SP, Brazil; Lechugo, C.P., Universidade de Sorocaba, SP, Brazil, Centro Paula Souza, SP, Brazil","This paper aims the proposal of model and its subsequent application of data mining techniques in a set of students answers collected during an Institutional Evaluation. Using Educational Data Mining, the proposed model looks for new categories of analysis in the student's discourse and contribute to Teachers Evaluation effectiveness and promotes reflections about teaching practices. Therefore, the authors propose an Institutional Teaching Evaluation model that applies, among others, the Sentiment Analysis to identify which teaching practices are positive or negative from the perspective of students from Higher Education Institution. © 2017.","Educational data mining; Institutional evaluation; Sentiment analysis",,,,"Revista Espacios",07981015,,,,"Portuguese","Espacios",Article,"Final",,Scopus,2-s2.0-85013824408
"de Souza Lima E., de Souza Z.M., Montanari R., de Medeiros Oliveira S.R., Lovera L.H., Vieira Farhate C.V.","57193315259;6603234996;8400819200;57193229671;36975879700;56668772700;","Classification of the initial development of eucaliptus using data mining techniques [Classificação do desenvolvimento inicial do eucalipto utilizando técnicas de mineração de dados]",2017,"Cerne","23","2",,"201","208",,1,"10.1590/01047760201723022296","https://www.scopus.com/inward/record.uri?eid=2-s2.0-85026488861&doi=10.1590%2f01047760201723022296&partnerID=40&md5=e450a42f1a7f96430d3a3202860ec66c","Universty of Campinas - CampinasSão Paulo, Brazil; Paulista State University - JaboticabalSão Paulo, Brazil; Brasilian Agricultural Research - CampinasSão Paulo, Brazil","de Souza Lima, E., Universty of Campinas - CampinasSão Paulo, Brazil; de Souza, Z.M., Universty of Campinas - CampinasSão Paulo, Brazil; Montanari, R., Paulista State University - JaboticabalSão Paulo, Brazil; de Medeiros Oliveira, S.R., Brasilian Agricultural Research - CampinasSão Paulo, Brazil; Lovera, L.H., Universty of Campinas - CampinasSão Paulo, Brazil; Vieira Farhate, C.V., Universty of Campinas - CampinasSão Paulo, Brazil","Eucalyptus plantation has expanded considerably in Brazil, especially in regions where soils have low fertility, such as in Brazilian Cerrados. To achieve greater productivity, it is essential to know the needs of the soil and the right moment to correct it. Mathematical and computational models have been used as a promising alternative to help in this decision-making process. The aim of this study was to model the influence of climate and physico-chemical attributes in the development of Eucalyptus urograndis in Entisol quartzipsamment soil using the decision tree induction technique. To do so, we used 30 attributes, 29 of them are predictive and one is the target-attribute or response variable regarding the height of the eucalyptus. We defined four approaches to select these features: no selection, Correlation-based Feature Selection (CFS), Chi-square test (X2) and Wrapper. To classify the data, we used the decision tree induction technique available in the Weka software 3.6. This data mining technique allowed us to create a classification model for the initial development of eucalyptus. From this model, one can predict new cases in different production classes, in which the individual wood volume (IWV) and the diameter at breast height (DBH) are crucial features to predict the growth of Eucalyptus urograndis, in addition to the presence of chemical soil components such as: magnesium (Mg+2), phosphorus (P), aluminum (Al+3), potassium (K+), potential acidity (H + Al), hydrogen potential (pH), and physical attributes such as soil resistance to penetration and related to climate, such as minimum temperature. © 2017, Federal University of Lavras. All rights reserved.","Decision tree; Entisol quartzipsamment soil; Eucalyptus urograndis; Feature selection; Individual wood volume","acidity; aluminum; data mining; deciduous tree; decision making; hydrogen; magnesium; numerical model; phosphorus; potassium; software; Brazil; Eucalyptus; Eucalyptus urograndis; Gallirallus australis","de Souza Lima, E.; Universty of Campinas - CampinasBrazil; email: elizeu.florestal@gmail.com",,"Federal University of Lavras",01047760,,,,"English","Cerne",Article,"Final",Open Access,Scopus,2-s2.0-85026488861
"Reis D.G., Carvalho R.N., Carvalho R.S., Ladeira M.","57201501422;24483285100;56511208700;57215425602;","Two-phase parallel learning to identify similar structures among relational databases",2017,"Proceedings - 16th IEEE International Conference on Machine Learning and Applications, ICMLA 2017","2017-December",,,"1020","1023",,2,"10.1109/ICMLA.2017.00-17","https://www.scopus.com/inward/record.uri?eid=2-s2.0-85048473616&doi=10.1109%2fICMLA.2017.00-17&partnerID=40&md5=bc45728de281c9a792aea1dc71fbc91f","Department of Computer Science, University of Brasilia-UnB, Brasilia-DF, 70910-900, Brazil; Ministry of Social Development of Brazil, Brasilia-DF, 70054-906, Brazil","Reis, D.G., Department of Computer Science, University of Brasilia-UnB, Brasilia-DF, 70910-900, Brazil, Ministry of Social Development of Brazil, Brasilia-DF, 70054-906, Brazil; Carvalho, R.N., Department of Computer Science, University of Brasilia-UnB, Brasilia-DF, 70910-900, Brazil; Carvalho, R.S., Department of Computer Science, University of Brasilia-UnB, Brasilia-DF, 70910-900, Brazil; Ladeira, M., Department of Computer Science, University of Brasilia-UnB, Brasilia-DF, 70910-900, Brazil","The need for efficient techniques for dealing with large databases increases as the number of large databases grows. We propose a new two-phase parallel learning approach to identify similar structures of relational databases fast. Each phase represents a level of relational metadata aggregation. To test the approach, we realized an experiment in with several large databases of Ministry of Social Development of Brazil to classify which relational database have a similar structure of tables and columns, based on its metadata. The measure of similarity considered Levenshtein and cosine. Generalized Linear Model, Random Forest, and Gradient Boost Machines (GBM) techniques are applied to develop the model. Each model was executed in sequential and parallel processing and had performance compared. As results, the parallel execution of GBM was at least ten times faster than the sequential processing. The results encourage further applications of the propositional parallel learning in relational databases. © 2017 IEEE.","data mining; large dataset; metadata; parallel learning; relational database; schema matching","Data mining; Decision trees; Large dataset; Machine learning; Metadata; Generalized linear model; Measure of similarities; Metadata aggregation; Parallel learning; Parallel learning approaches; Relational Database; Schema matching; Sequential processing; Classification (of information)",,"Chen X.Luo B.Luo F.Palade V.Wani M.A.","Institute of Electrical and Electronics Engineers Inc.",,9781538614174,,,"English","Proc. - IEEE Int. Conf. Mach. Learning Appl., ICMLA",Conference Paper,"Final",,Scopus,2-s2.0-85048473616
"Manica E., Dorneles C.F., Galante R.","36460178500;8216943500;6602706840;","Orion: A cypher-based web data extractor",2017,"Lecture Notes in Computer Science (including subseries Lecture Notes in Artificial Intelligence and Lecture Notes in Bioinformatics)","10438 LNCS",,,"275","289",,1,"10.1007/978-3-319-64468-4_21","https://www.scopus.com/inward/record.uri?eid=2-s2.0-85028458707&doi=10.1007%2f978-3-319-64468-4_21&partnerID=40&md5=cf5b8fc043e42f68b53b7deb8ee1ad7a","II - UFRGS, Porto Alegre, RS, Brazil; Campus Ibirubá - IFRS, Ibirubá, RS, Brazil; INE/CTC - UFSC, Florianópolis, SC, Brazil","Manica, E., II - UFRGS, Porto Alegre, RS, Brazil, Campus Ibirubá - IFRS, Ibirubá, RS, Brazil; Dorneles, C.F., INE/CTC - UFSC, Florianópolis, SC, Brazil; Galante, R., II - UFRGS, Porto Alegre, RS, Brazil","The challenges in Big Data start during the data acquisition, where it is necessary to transform non-structured data into a structured format. One example of relevant data in a non-structured format is observed in entity-pages. An entity-page publishes data that describe an entity of a particular type (e.g. a soccer player). Extracting attribute values from these pages is a strategic task for data-driven companies. This paper proposes a novel class of data extraction methods inspired by the graph databases and graph query languages. Our method, called Orion, uses the same declarative language to learn the extraction rules and to express the extraction rules. The use of a declarative language allows the specification to be decoupled from the implementation. Orion models the problem of extracting attribute values from entity-pages as Cypher queries in a graph database. To the best of our knowledge, this is the first work that models the problem of extracting attribute values from template-based entity-pages in this way. Graph databases integrate the alternative database management systems, which are taking over Big Data (with the generic name of NoSQL) because they implement novel representation paradigms and data structures. Cypher is more robust than XPath (a query language that is common used to handle web pages) because it allows traversing, querying and updating the graph, while XPath is a language specific for traversing DOM trees. We carried out experiments on a dataset with more than 145k web pages from different real-world websites of a wide range of entity types. The Orion method reached 98% of F1. Our method was compared with one state-of-the-art method and outperformed it with a gain regarding F1 of 5%. © 2017, Springer International Publishing AG.","Cypher; Data extraction; Graph database; Graph query language; NoSQL","Big data; Data acquisition; Data mining; Expert systems; Extraction; Information management; Query languages; Query processing; Websites; Cypher; Data extraction; Graph database; Graph query language; NoSQL; Trees (mathematics)","Manica, E.; II - UFRGSBrazil; email: edimar.manica@inf.ufrgs.br","Benslimane D.Sheth A.Damiani E.Hameurlain A.Grosky W.I.Wagner R.R.","Springer Verlag",03029743,9783319644677,,,"English","Lect. Notes Comput. Sci.",Conference Paper,"Final",,Scopus,2-s2.0-85028458707
"Coelho I.M., Coelho V.N., Luz E.J.D.S., Ochi L.S., Guimarães F.G., Rios E.","55116426700;55505662100;54788047000;8935888900;7005645510;8935888800;","A GPU deep learning metaheuristic based model for time series forecasting",2017,"Applied Energy","201",,,"412","418",,37,"10.1016/j.apenergy.2017.01.003","https://www.scopus.com/inward/record.uri?eid=2-s2.0-85020448843&doi=10.1016%2fj.apenergy.2017.01.003&partnerID=40&md5=a44cb3ede4bb315faa6cbc47f6c5cec4","Grupo da Causa Humana, Ouro Preto, Brazil; Department of Computing, State University of Rio de Janeiro, Rio de Janeiro, Brazil; Institute of Computing, Universidade Federal Fluminense, Niterói, Brazil; Department of Computing, Universidade Federal de Ouro Preto, Ouro Preto, Brazil; Department of Electrical Engineering, Universidade Federal de Minas Gerais, Belo Horizonte, Brazil; Institute of Computing, UESPI, Paranaíba, Brazil","Coelho, I.M., Grupo da Causa Humana, Ouro Preto, Brazil, Department of Computing, State University of Rio de Janeiro, Rio de Janeiro, Brazil; Coelho, V.N., Grupo da Causa Humana, Ouro Preto, Brazil, Institute of Computing, Universidade Federal Fluminense, Niterói, Brazil; Luz, E.J.D.S., Department of Computing, Universidade Federal de Ouro Preto, Ouro Preto, Brazil; Ochi, L.S., Institute of Computing, Universidade Federal Fluminense, Niterói, Brazil; Guimarães, F.G., Department of Electrical Engineering, Universidade Federal de Minas Gerais, Belo Horizonte, Brazil; Rios, E., Institute of Computing, UESPI, Paranaíba, Brazil","As the new generation of smart sensors is evolving towards high sampling acquisitions systems, the amount of information to be handled by learning algorithms has been increasing. The Graphics Processing Unit (GPU) architecture provides a greener alternative with low energy consumption for mining big data, bringing the power of thousands of processing cores into a single chip, thus opening a wide range of possible applications. In this paper (a substantial extension of the short version presented at REM2016 on April 19–21, Maldives [1]), we design a novel parallel strategy for time series learning, in which different parts of the time series are evaluated by different threads. The proposed strategy is inserted inside the core a hybrid metaheuristic model, applied for learning patterns from an important mini/microgrid forecasting problem, the household electricity demand forecasting. The future smart cities will surely rely on distributed energy generation, in which citizens should be aware about how to manage and control their own resources. In this sense, energy disaggregation research will be part of several typical and useful microgrid applications. Computational results show that the proposed GPU learning strategy is scalable as the number of training rounds increases, emerging as a promising deep learning tool to be embedded into smart sensors. © 2017 Elsevier Ltd","Big data time-series; Deep learning; Graphics processing unit; Household electricity demand; Hybrid forecasting model; Smart sensors","Big data; Computer graphics; Computer graphics equipment; Data mining; Deep learning; Electric power utilization; Energy utilization; Forecasting; Learning algorithms; Program processors; Smart city; Smart sensors; Time series; Amount of information; Computational results; Electricity demand forecasting; Electricity demands; Hybrid forecasting; Hybrid Meta-heuristic; Low energy consumption; Time series forecasting; Graphics processing unit; algorithm; data mining; data processing; energy efficiency; forecasting method; graphical method; heuristics; household energy; numerical model; sensor; smart grid; time series; time series analysis; Maldives","Coelho, I.M.; Grupo da Causa HumanaBrazil; email: igor.machado@ime.uerj.br",,"Elsevier Ltd",03062619,,APEND,,"English","Appl. Energy",Article,"Final",,Scopus,2-s2.0-85020448843
