"Rosa C.R.M., Okoshi C.Y., Steiner M.T.A., da Silva R.G., da Silva W.V.","55823500900;56500526100;8901199600;56499888100;17433858200;","Knowledge discovery in databases in the production process of alumina [Descoberta de conhecimento em bases de dados no processo de produção de alumina]",2014,"Espacios","35","12",,"","",19,,,"https://www.scopus.com/inward/record.uri?eid=2-s2.0-84922051584&partnerID=40&md5=773845685e1ce263878836f2d0cd3b1d","Pontifícia Universidade Católica do Paraná - PUCPR, Brazil","Rosa, C.R.M., Pontifícia Universidade Católica do Paraná - PUCPR, Brazil; Okoshi, C.Y., Pontifícia Universidade Católica do Paraná - PUCPR, Brazil; Steiner, M.T.A., Pontifícia Universidade Católica do Paraná - PUCPR, Brazil; da Silva, R.G., Pontifícia Universidade Católica do Paraná - PUCPR, Brazil; da Silva, W.V., Pontifícia Universidade Católica do Paraná - PUCPR, Brazil","This paper aims to perform the classification of patterns as the caustic soda content contained in the waste generated in alumina production process. For both 1060 data, each of which has nine variables and one output (content of caustic soda) were collected. Based on the KDD process an exploratory analysis of the data was performed and then the data mining technique, Binary Logistic Regression was applied. Through the results obtained, we can conclude that this analysis was very efficient in this study, with an overall accuracy rate of 100% accuracy.","Alumina production process; Databases; KDD brazil",,,,"Revista Espacios",07981015,,,,"Portuguese","Espacios",Article,"Final",,Scopus,2-s2.0-84922051584
"Porto W.F., Maria-Neto S., Nolasco D.O., Franco O.L.","34870538400;25936525600;55359101600;7003941773;","Screening and functional prediction of conserved hypothetical proteins from Escherichia coli",2014,"Journal of Proteomics and Bioinformatics","7","7",,"203","213",,5,"10.4172/jpb.1000321","https://www.scopus.com/inward/record.uri?eid=2-s2.0-84905194818&doi=10.4172%2fjpb.1000321&partnerID=40&md5=7841ed4f6b417eea59a71078bd3967b6","Centre for Proteomic and Biochemical Analysis, Graduate Studies in Biotechnology and Genomic Sciences, Catholic University of Brasilia, Brasilia-DF, 70790-160, Brazil; Course of Physics, Catholic University of Brasilia, Brasilia-DF, 70966-700, Brazil; Biotechnology, Dom Bosco Catholic University, Campo Grande, MS, Brazil","Porto, W.F., Centre for Proteomic and Biochemical Analysis, Graduate Studies in Biotechnology and Genomic Sciences, Catholic University of Brasilia, Brasilia-DF, 70790-160, Brazil; Maria-Neto, S., Centre for Proteomic and Biochemical Analysis, Graduate Studies in Biotechnology and Genomic Sciences, Catholic University of Brasilia, Brasilia-DF, 70790-160, Brazil; Nolasco, D.O., Centre for Proteomic and Biochemical Analysis, Graduate Studies in Biotechnology and Genomic Sciences, Catholic University of Brasilia, Brasilia-DF, 70790-160, Brazil, Course of Physics, Catholic University of Brasilia, Brasilia-DF, 70966-700, Brazil; Franco, O.L., Centre for Proteomic and Biochemical Analysis, Graduate Studies in Biotechnology and Genomic Sciences, Catholic University of Brasilia, Brasilia-DF, 70790-160, Brazil, Biotechnology, Dom Bosco Catholic University, Campo Grande, MS, Brazil","Protein structures can provide some functional evidences. Therefore structural genomics efforts to identify the functions of hypothetical proteins have brought advances in our understanding of biological systems. To this end, a new strategy to mine protein databases in the search for candidates for function prediction was here described. The strategy was applied to Escherichia coli proteins deposited in the NCBI's non-redundant database. Briefly, data mining selects small conserved hypothetical proteins without significant templates on Protein Data Bank, without transmembrane regions and with similarity to Eukaryote proteins. Through this strategy, 12 protein sequences were selected for molecular modelling, from a total of 13,306 E. coli's conserved hypothetical sequences. From these, only three sequences could be modelled. GI 488361128 model was similar to cupredoxins, GI 281178323 model was similar to β-barrel proteins and GI 227886634 model showed structural similarities to lipid binding proteins. However, only the GI 227886634 seems to have a function related to the similar structures, since it was the unique structure that kept the fold during the molecular dynamics simulation. The method here described can be relevant to select hypothetical sequences that can be targets for in vitro and/or in vivo functional characterization. © 2014 Porto WF, et al.","Cupredoxins; Function prediction; Lipid binding proteins; Molecular modelling; Structural genomics; β-barrel proteins","Escherichia coli protein; phospholipase; algorithm; amino acid sequence; article; data mining; molecular dynamics; molecular model; prediction; protein analysis; Protein Data Bank; protein function; protein interaction; protein secondary structure; scoring system; sequence alignment; simulation","Franco, O. L.; Centre for Proteomic and Biochemical Analysis, Graduate Studies in Biotechnology and Genomic Sciences, Catholic University of Brasilia, Brasilia-DF, 70790-160, Brazil; email: ocfranco@gmail.com",,"OMICS Publishing Group",0974276X,,,,"English","J. Proteomics Bioinformatics",Article,"Final",Open Access,Scopus,2-s2.0-84905194818
"Assunção J., Fernandes P., Lopes L., Normey S.","55843438700;7102795205;25928649000;55893466300;","A dimensionality reduction process to forecast events through stochastic models",2014,"Proceedings of the International Conference on Software Engineering and Knowledge Engineering, SEKE","2014-January","January",,"534","539",,1,,"https://www.scopus.com/inward/record.uri?eid=2-s2.0-84938375233&partnerID=40&md5=aaeb9471be6d6f98f25aeff11ed5d267","PUCRS University, Computer Science Department, Porto Alegre, Brazil","Assunção, J., PUCRS University, Computer Science Department, Porto Alegre, Brazil; Fernandes, P., PUCRS University, Computer Science Department, Porto Alegre, Brazil; Lopes, L., PUCRS University, Computer Science Department, Porto Alegre, Brazil; Normey, S., PUCRS University, Computer Science Department, Porto Alegre, Brazil","This paper describes a dimensionality reduction process to forecast time series events using stochastic models. As well as the KDD process defines a sequence of common steps to achieve useful information through data mining techniques, we propose a sequence of steps in order to estimate the probability of future events through stochastic modeling. Our process focus on reduce the dimensionality of data, thus reducing the effect of the common problems involved in stochastic modeling, such as the state space explosion and the large modeling efforts to create such models. Copyright © 2014 by Knowledge Systems Institute Graduate School.",,,,,"Knowledge Systems Institute Graduate School",23259000,,,,"English","Proc. Int. Conf. Softw. Eng. Knowl. Eng., SEKE",Conference Paper,"Final",,Scopus,2-s2.0-84938375233
"De Souza F.T.","36617082000;","A data-based model to locate mass movements triggered by seismic events in Sichuan, China",2014,"Environmental Monitoring and Assessment","186","1",,"575","587",,5,"10.1007/s10661-013-3400-3","https://www.scopus.com/inward/record.uri?eid=2-s2.0-84891315642&doi=10.1007%2fs10661-013-3400-3&partnerID=40&md5=353bed900cd4df46654783f7958f567e","Postgraduate Program in Urban Management (PPGTU), Pontifical Catholic University of Paraná (PUC-PR), Polytechnic School and School of Architecture and Design, Rua Imaculada Conceição-1155-Prado Velho, 80215-901 Curitiba Paraná, Brazil; Department of Hydraulics and Sanitation (DHS), Federal University of Parana (UFPR), Curitiba, Brazil","De Souza, F.T., Postgraduate Program in Urban Management (PPGTU), Pontifical Catholic University of Paraná (PUC-PR), Polytechnic School and School of Architecture and Design, Rua Imaculada Conceição-1155-Prado Velho, 80215-901 Curitiba Paraná, Brazil, Department of Hydraulics and Sanitation (DHS), Federal University of Parana (UFPR), Curitiba, Brazil","Earthquakes affect the entire world and have catastrophic consequences. On May 12, 2008, an earthquake of magnitude 7.9 on the Richter scale occurred in the Wenchuan area of Sichuan province in China. This event, together with subsequent aftershocks, caused many avalanches, landslides, debris flows, collapses, and quake lakes and induced numerous unstable slopes. This work proposes a methodology that uses a data mining approach and geographic information systems to predict these mass movements based on their association with the main and aftershock epicenters, geologic faults, riverbeds, and topography. A dataset comprising 3,883 mass movements is analyzed, and some models to predict the location of these mass movements are developed. These predictive models could be used by the Chinese authorities as an important tool for identifying risk areas and rescuing survivors during similar events in the future. © 2013 Springer Science+Business Media Dordrecht.","Artificial neural networks; Data mining; Earthquake; Geographic information systems; Mass movements","Catastrophic consequences; Data-based modeling; Geologic faults; Mass movement; Predictive models; Richter scale; Sichuan , China; Sichuan province; Data mining; Geographic information systems; Neural networks; Earthquakes; aftershock; artificial neural network; catastrophic event; data mining; earthquake epicenter; earthquake magnitude; earthquake trigger; GIS; mass movement; article; China; data mining; earthquake; environmental monitoring; environmental parameters; geographic information system; mass movement; prediction; statistical analysis; statistical model; China; Sichuan","De Souza, F.T.; Postgraduate Program in Urban Management (PPGTU), Pontifical Catholic University of Paraná (PUC-PR), Polytechnic School and School of Architecture and Design, Rua Imaculada Conceição-1155-Prado Velho, 80215-901 Curitiba Paraná, Brazil; email: fabio.teodoro@pucpr.br",,,01676369,,EMASD,,"English","Environ. Monit. Assess.",Article,"Final",,Scopus,2-s2.0-84891315642
"Brandão A.L., Fernandes L.A.F., Trevisan D., Clua E., Stricker D.","22933912300;19337088600;35827468700;24450364400;6701489212;","Jecripe: How a serious game project encouraged studies in different computer science areas",2014,"SeGAH 2014 - IEEE 3rd International Conference on Serious Games and Applications for Health, Books of Proceedings",,, 7067077,"","",,4,"10.1109/SeGAH.2014.7067077","https://www.scopus.com/inward/record.uri?eid=2-s2.0-84988220700&doi=10.1109%2fSeGAH.2014.7067077&partnerID=40&md5=b4dc9e5a6f7db225593eb3c3e449172a","Computer Science Institute, Fluminense Federal University, Niterói, 24210-240, Brazil; German Research Center for Artificial Intelligence (DFKI), Kaiserslautern, Germany; Technical University of Kaiserslautern, Germany","Brandão, A.L., Computer Science Institute, Fluminense Federal University, Niterói, 24210-240, Brazil, German Research Center for Artificial Intelligence (DFKI), Kaiserslautern, Germany; Fernandes, L.A.F., Computer Science Institute, Fluminense Federal University, Niterói, 24210-240, Brazil; Trevisan, D., Computer Science Institute, Fluminense Federal University, Niterói, 24210-240, Brazil; Clua, E., Computer Science Institute, Fluminense Federal University, Niterói, 24210-240, Brazil; Stricker, D., Computer Science Institute, Fluminense Federal University, Niterói, 24210-240, Brazil, Technical University of Kaiserslautern, Germany","Serious game projects require multidisciplinary professionals, including programmers, designers and game designers. In games for health, one more type of professional must be included which is the one with health knowledge. The Jecripe Project has the aim of developing serious games for people with special needs. The professionals from health science are speech therapists and more professionals have the intention to be part of the mentioned project. However, this work presents how a serious game project motivated studies in different Computer Science research areas. We describe the three main studies in the Jecripe Project, each of one in a different area: Computer Vision, Data Mining and Human-Computer Interaction. The intention of the continuation in the project is to perform more studies including the integration of natural user interfaces in games for people with special needs.",,"Computer vision; Data mining; Health; Human computer interaction; User interfaces; Computer science research; Game designers; Health science; Natural user interfaces; Serious games; Special needs; Computer games",,,"Institute of Electrical and Electronics Engineers Inc.",,9781479948239,,,"English","SeGAH - IEEE Int. Conf. Serious Games Appl. Health, Books Proc.",Conference Paper,"Final",,Scopus,2-s2.0-84988220700
"Santos R.L.T., Castells P., Altingovde I.S., Can F.","27868004100;8928406700;6507657395;7004720706;","Diversity and novelty in web search, recommender systems and data streams",2014,"WSDM 2014 - Proceedings of the 7th ACM International Conference on Web Search and Data Mining",,,,"679","",,1,"10.1145/2556195.2556199","https://www.scopus.com/inward/record.uri?eid=2-s2.0-84906877452&doi=10.1145%2f2556195.2556199&partnerID=40&md5=96573e1411c04c775e193a4d42c393a1","Univ. Federal de Minas Gerais, Belo Horizonte, MG, Brazil; Univ. Autónoma de Madrid, Madrid, Spain; Middle East Technical University, Ankara, Turkey; Bilkent University, Ankara, Turkey","Santos, R.L.T., Univ. Federal de Minas Gerais, Belo Horizonte, MG, Brazil; Castells, P., Univ. Autónoma de Madrid, Madrid, Spain; Altingovde, I.S., Middle East Technical University, Ankara, Turkey; Can, F., Bilkent University, Ankara, Turkey","This tutorial aims to provide a unifying account of current research on diversity and novelty in the domains of web search, recommender systems, and data stream processing. © 2014 Authors.","ambiguity; diversity; novelty; redundancy; relevance","Data communication systems; Recommender systems; Redundancy; Websites; ambiguity; Data stream; Data stream processing; diversity; novelty; relevance; Web searches; Data mining",,,"Association for Computing Machinery",,9781450323512,,,"English","WSDM - Proc. ACM Int. Conf. Web Search Data Min.",Conference Paper,"Final",,Scopus,2-s2.0-84906877452
"Dos Santos C.N., Gatti M.","55665418300;55319933300;","Deep convolutional neural networks for sentiment analysis of short texts",2014,"COLING 2014 - 25th International Conference on Computational Linguistics, Proceedings of COLING 2014: Technical Papers",,,,"69","78",,587,,"https://www.scopus.com/inward/record.uri?eid=2-s2.0-84932166511&partnerID=40&md5=c9825887048817f46442e8d5306163a5","Brazilian Research Lab, IBM Research, Brazil","Dos Santos, C.N., Brazilian Research Lab, IBM Research, Brazil; Gatti, M., Brazilian Research Lab, IBM Research, Brazil","Sentiment analysis of short texts such as single sentences and Twitter messages is challenging because of the limited contextual information that they normally contain. Effectively solving this task requires strategies that combine the small text content with prior knowledge and use more than just bag-of-words. In this work we propose a new deep convolutional neural network that exploits from character- To sentence-level information to perform sentiment analysis of short texts. We apply our approach for two corpora of two different domains: The Stanford Sentiment Treebank (SSTb), which contains sentences from movie reviews; and the Stanford Twitter Sentiment corpus (STS), which contains Twitter messages. For the SSTb corpus, our approach achieves state-of-the-art results for single sentence sentiment prediction in both binary positive/negative classification, with 85.7% accuracy, and fine-grained classification, with 48.3% accuracy. For the STS corpus, our approach achieves a sentiment prediction accuracy of 86.4%.",,"Classification (of information); Convolution; Data mining; Linguistics; Neural networks; Social networking (online); Contextual information; Convolutional neural network; Different domains; Positive/negative classifications; Prediction accuracy; Prior knowledge; Sentiment analysis; State of the art; Computational linguistics",,,"Association for Computational Linguistics, ACL Anthology",,9781941643266,,,"English","COLING - Int. Conf. Comput. Linguist. - Tech. Pap.",Conference Paper,"Final",,Scopus,2-s2.0-84932166511
"Santos D., Perkusich A., Almeida H.","56437272100;6701736103;22733296600;","A topic aware-based approach to maximize social influence",2014,"WebMedia 2014 - Proceedings of the 20th Brazilian Symposium on Multimedia and the Web",,,,"187","194",,1,"10.1145/2664551.2664571","https://www.scopus.com/inward/record.uri?eid=2-s2.0-84914693634&doi=10.1145%2f2664551.2664571&partnerID=40&md5=5e8e85ae7b2c2d714bf10ea2e9f941cc","Post-Graduate Program in, Electrical Engineering -PPgEE - COPELE, Federal University of Campina Grande (UFCG), Campina Grande-PB, 58429-900, Brazil; Electrical Engineering Department, Federal University of Campina Grande, Campina Grande -PB, 58429-900, Brazil; Systems and Computing Department, Federal University of Campina Grande, Campina Grande -PB, 58429-900, Brazil","Santos, D., Post-Graduate Program in, Electrical Engineering -PPgEE - COPELE, Federal University of Campina Grande (UFCG), Campina Grande-PB, 58429-900, Brazil; Perkusich, A., Electrical Engineering Department, Federal University of Campina Grande, Campina Grande -PB, 58429-900, Brazil; Almeida, H., Systems and Computing Department, Federal University of Campina Grande, Campina Grande -PB, 58429-900, Brazil","The use of social networks has shown great potential for information diffusion and formation of public opinion. One key problem that has attracted researchers interest is Topicbased Influence Maximization, that refers to finding a small set of users on a social network that have the ability to influence a substantial portion of users on a given topic. The proposed solutions, however, are not suitable for large-scale social networks and must incorporate mechanisms for determining social influence among users on each topic of interest. Consequently, for these approaches, it becomes difficult or even unfeasible to deal quickly and efficiently with constant changes in the structure of social networks. This problem is particularly relevant as the topics of interest of users and the social influence they exert on each other for every topic are considered together. In this work, it is proposed a scalable solution, that makes use of data mining over an information propagation log, in order to directly select the initial set of influential users on a particular topic without the need to incorporate a previous step for learning users social influence with regard to that topic. As an additional benefit, the targeted seed set also offers an approximation guarantee of the optimal solution. Finally, it is presented a design of experiments over a data set containing information propagation data from a real social network. As main results, we have found some evidences that the proposed solution maintains a trade-off between scalability and accuracy. Copyright © 2014 ACM.","Design Experimentation.; Social Influence Analysis; Social Networks; Topic-based InfluenceMaximization","Data mining; Design of experiments; Experiments; Information dissemination; Social aspects; Social networking (online); Solution mining; Design experimentations; Influence maximizations; Influential users; Information diffusion; Information propagation; Scalable solution; Social influence; Topic-based InfluenceMaximization; Economic and social effects","Santos, D.; Post-Graduate Program in, Electrical Engineering -PPgEE - COPELE, Federal University of Campina Grande (UFCG)Brazil",,"Association for Computing Machinery, Inc",,9781450332309,,,"Portuguese","WebMedia - Proc. Braz. Symp. Multimed. Web",Conference Paper,"Final",,Scopus,2-s2.0-84914693634
"Holsbach N., Fogliatto F.S., Anzanello M.J.","55993480000;6603637370;16314941500;","A data mining method for breast cancer identification based on a selection of variables [Método de mineração de dados para identificação de câncer de mama baseado na seleção de variáveis]",2014,"Ciencia e Saude Coletiva","19","4",,"1295","1304",,3,"10.1590/1413-81232014194.01722013","https://www.scopus.com/inward/record.uri?eid=2-s2.0-84899766031&doi=10.1590%2f1413-81232014194.01722013&partnerID=40&md5=af159d51a9e189d8508468f26ae8c97c","Escola de Engenharia, Universidade Federal do Rio Grande do Sul, Av. Osvaldo Aranha 99/50 Centro. 90, 035-190 Porto Alegre RS, Brazil","Holsbach, N., Escola de Engenharia, Universidade Federal do Rio Grande do Sul, Av. Osvaldo Aranha 99/50 Centro. 90, 035-190 Porto Alegre RS, Brazil; Fogliatto, F.S., Escola de Engenharia, Universidade Federal do Rio Grande do Sul, Av. Osvaldo Aranha 99/50 Centro. 90, 035-190 Porto Alegre RS, Brazil; Anzanello, M.J., Escola de Engenharia, Universidade Federal do Rio Grande do Sul, Av. Osvaldo Aranha 99/50 Centro. 90, 035-190 Porto Alegre RS, Brazil","In the majority of countries, breast cancer among women is highly prevalent. If diagnosed in the early stages, there is a high probability of a cure. Several statistical-based approaches have been developed to assist in early breast cancer detection. This paper presents a method for selection of variables for the classification of cases into two classes, benign or malignant, based on cyto-pathological analysis of breast cell samples of patients. The variables are ranked according to a new index of importance of variables that combines the weighting importance of Principal Component Analysis and the explained variance based on each retained component. Observations from the test sample are categorized into two classes using the k-Nearest Neighbor algorithm and Discriminant Analysis, followed by elimination of the variable with the index of lowest importance. The subset with the highest accuracy is used to classify observations in the test sample. When applied to the Wisconsin Breast Cancer Database, the proposed method led to average of 97.77% in classification accuracy while retaining an average of 5.8 variables.","Breast cancer identification; Discriminant analysis; K-nearest neighbor algorithm (KNN); Selection of variables","Breast Neoplasms; data mining; early diagnosis; female; human; procedures; statistics and numerical data; Breast Neoplasms; Data Mining; Early Detection of Cancer; Female; Humans",,,"Associacao Brasileira de Pos - Graduacao em Saude Coletiva",14138123,,,"24820612","English; Portuguese","Cienc. Saude Coletiva",Article,"Final",Open Access,Scopus,2-s2.0-84899766031
"Raddick M.J., Thakar A.R., Szalay A.S., Santos R.D.C.","22836189500;14058813500;7102152943;7201375217;","Ten years of skyserver ii: How astronomers and the public have embraced e-science",2014,"Computing in Science and Engineering","16","4", 6762803,"32","40",,7,"10.1109/MCSE.2014.32","https://www.scopus.com/inward/record.uri?eid=2-s2.0-84906557239&doi=10.1109%2fMCSE.2014.32&partnerID=40&md5=2c2af601fefa63368f6914ff5a411ae6","Johns Hopkins University, United States; National Institute of Space Research (INPE), Brazil","Raddick, M.J., Johns Hopkins University, United States; Thakar, A.R., Johns Hopkins University, United States; Szalay, A.S., Johns Hopkins University, United States; Santos, R.D.C., National Institute of Space Research (INPE), Brazil","A comprehensive analysis of 10 years of Web and SQL traffic on SkyServer - the online portal to the multiterabyte Sloan Digital Sky Survey archive - shows the impressive reach of the SDSS to the research community and the public, and provides insight into how methods of e-science are being taken up by the scientific community. © 1999-2011 IEEE.","Astronomy; Data mining; Evaluation/methodology; Logical design; Query design and implementation languages; Query languages; Relational databases; Scientific computing; Scientific databases; User interfaces; Web mining","Data mining; Natural sciences computing; Query languages; User interfaces; Design and implementations; Evaluation/methodology; Logical design; Relational Database; Scientific database; Web Mining; Astronomy",,,"IEEE Computer Society",15219615,,CSENF,,"English","Comput. Sci. Eng.",Article,"Final",,Scopus,2-s2.0-84906557239
