"De Carvalho T.B.A., Sibaldo M.A.A., Tsang I.R., Cavalcanti G.D.C., Tsang I.J., Sijbers J.","36607662500;55557153000;7004570435;7004509486;7004570430;7003344927;","Fractional Eigenfaces",2014,"2014 IEEE International Conference on Image Processing, ICIP 2014",,, 7025051,"258","262",,6,"10.1109/ICIP.2014.7025051","https://www.scopus.com/inward/record.uri?eid=2-s2.0-84949928337&doi=10.1109%2fICIP.2014.7025051&partnerID=40&md5=938251fe6426d855e64d05bee7d61316","Unidade Acadêmica de Garanhuns, Universidade Federal Rural de Pernambuco, Brazil; Centro de Informática, Universidade Federal de Pernambuco, Recife, Brazil; IMinds-Vision Lab, University of Antwerp, Belgium; Alcatel-Lucent, Bell Labs, Antwerp, Belgium","De Carvalho, T.B.A., Unidade Acadêmica de Garanhuns, Universidade Federal Rural de Pernambuco, Brazil, Centro de Informática, Universidade Federal de Pernambuco, Recife, Brazil; Sibaldo, M.A.A., Unidade Acadêmica de Garanhuns, Universidade Federal Rural de Pernambuco, Brazil, Centro de Informática, Universidade Federal de Pernambuco, Recife, Brazil; Tsang, I.R., Centro de Informática, Universidade Federal de Pernambuco, Recife, Brazil, IMinds-Vision Lab, University of Antwerp, Belgium; Cavalcanti, G.D.C., Centro de Informática, Universidade Federal de Pernambuco, Recife, Brazil; Tsang, I.J., Alcatel-Lucent, Bell Labs, Antwerp, Belgium; Sijbers, J., IMinds-Vision Lab, University of Antwerp, Belgium","The proposed Fractional Eigenfaces method is a feature extraction technique for high dimensional data. It is related to Fractional PCA (FPCA), which is based on the theory of fractional covariance matrix, and it is an extension of the classical Eigenfaces. Like FPCA, it computes projections for a low dimensional space from the fractional covariance matrix and similar to the Eigenfaces, it is suited for high dimensional data. Moreover, the proposed technique extends the fractional transformation of the data for more stages of the feature extractions than FPCA. The Fractional Eigenfaces is evaluated in three different face databases. Results show that it achieves a higher accuracy rate than FPCA and Eigenfaces according to the Wilcoxon hypothesis test. © 2014 IEEE.","Dimensionality reduction; Face recognition; Fractional covariance matrix; Principal component analysis","Clustering algorithms; Covariance matrix; Data mining; Face recognition; Feature extraction; Image processing; Matrix algebra; Metadata; Dimensionality reduction; Eigenfaces method; Face database; Feature extraction techniques; Fractional transformations; High dimensional data; Hypothesis tests; Low-dimensional spaces; Principal component analysis",,,"Institute of Electrical and Electronics Engineers Inc.",,9781479957514,,,"English","IEEE Int. Conf. Image Process., ICIP",Conference Paper,"Final",,Scopus,2-s2.0-84949928337
"Boscarioli C., Viterbo J., Felipe Teixeira M., Röhsig V.H.","26422017000;26649180300;56263759200;56263209200;","Analyzing HCI issues in data clustering tools",2014,"Lecture Notes in Computer Science (including subseries Lecture Notes in Artificial Intelligence and Lecture Notes in Bioinformatics)","8521 LNCS","PART 1",,"22","33",,,"10.1007/978-3-319-07731-4_3","https://www.scopus.com/inward/record.uri?eid=2-s2.0-84904120237&doi=10.1007%2f978-3-319-07731-4_3&partnerID=40&md5=88b43fa276f643e14c610f95c15f6b80","Western Paraná State University (UNIOESTE), Cascavel, Paraná, Brazil; Federal Fluminense University (UFF), Niterói, Rio de Janeiro, Brazil","Boscarioli, C., Western Paraná State University (UNIOESTE), Cascavel, Paraná, Brazil; Viterbo, J., Federal Fluminense University (UFF), Niterói, Rio de Janeiro, Brazil; Felipe Teixeira, M., Western Paraná State University (UNIOESTE), Cascavel, Paraná, Brazil; Röhsig, V.H., Federal Fluminense University (UFF), Niterói, Rio de Janeiro, Brazil","Due to the rapid growth in the volume of data stored in organizational databases and the human limitations in analyzing and interpreting data, appropriate technics are necessary to allow the identification of a large amount of information and knowledge in such databases. In this context, several techniques and tools have been proposed for enabling the end user to interpret his dataset. In this work we discuss the ways of interacting with cluster analysis tools, taking into account both the clustering and the interpretation stages. We investigate how usability and user experience aspects of such tools can improve the understanding of the discovered knowledge. Moreover, we evaluate the role of visualization methods in the comprehension of groups formed in cluster analysis using Knime, Orange Canvas, RapidMiner Studio and Weka data mining tools. © 2014 Springer International Publishing.","Data Mining Tools; HCI; User Evaluation","Cluster analysis; Clustering algorithms; Data mining; Data clustering; Data-mining tools; Human limitations; Large amounts; Techniques and tools; User evaluations; User experience; Visualization method; Human computer interaction",,,"Springer Verlag",03029743,9783319077307,,,"English","Lect. Notes Comput. Sci.",Conference Paper,"Final",,Scopus,2-s2.0-84904120237
"Lopes P., Fernandes S., Melo W., Sadok D.H.","7103176639;56235430100;55695572300;6603634824;","GPU-oriented stream data mining traffic classification",2014,"Proceedings - International Symposium on Computers and Communications",,, 6912457,"","",,1,"10.1109/ISCC.2014.6912457","https://www.scopus.com/inward/record.uri?eid=2-s2.0-84908191172&doi=10.1109%2fISCC.2014.6912457&partnerID=40&md5=0700f2e6bb1f210830166ec0f6801464","UFPE, Recife, Brazil","Lopes, P., UFPE, Recife, Brazil; Fernandes, S., UFPE, Recife, Brazil; Melo, W., UFPE, Recife, Brazil; Sadok, D.H., UFPE, Recife, Brazil","Network Management depends on precise characterization of the traffic profile of networked applications. When the identification and classification of network flows is done using machine learning, the characterization of traffic still requires an approach that is capable of providing a balance between accuracy and processing speed in real-time scenarios. This paper proposes an architecture to classify network traffic based on Stream Data Mining techniques using Graphic Processing Units (GPU), in order to meet the requirements of both classification accuracy and speed. Our proposal combines the characteristics of data mining techniques with a continuous stream of input data, and with high processing performance GPU architecture. Results show that our approach provides accuracy comparable to or better than existing related work (e.g., above 95%) while ramping up performance (e.g., up to 62x speed up), comparing the different implementations of our approach. These facts allow the deployment of the proposed technique to the real-time management of high speed backbone links. © 2014 IEEE.","Computer Networks; Flow-based Classification; GPU; Stream Data Mining; Traffic Classification","GPU; Stream data mining; Traffic classification; Computer networks","Lopes, P.; UFPEBrazil",,"Institute of Electrical and Electronics Engineers Inc.",15301346,9781479942787,,,"English","Proc. Int. Symp. Comput. Commun.",Conference Paper,"Final",,Scopus,2-s2.0-84908191172
"Guerine M., Rosseti I., Plastino A.","56204059200;15837970600;56187378700;","Extending the hybridization of metaheuristics with data mining to a broader domain",2014,"ICEIS 2014 - Proceedings of the 16th International Conference on Enterprise Information Systems","1",,,"395","406",,4,"10.5220/0004891303950406","https://www.scopus.com/inward/record.uri?eid=2-s2.0-84902357307&doi=10.5220%2f0004891303950406&partnerID=40&md5=6adb245dcc28c0ebce0af1296b728678","Institute of Computing, Federal Fluminense University, Niterói, 24210-240 Rio de Janeiro, Brazil","Guerine, M., Institute of Computing, Federal Fluminense University, Niterói, 24210-240 Rio de Janeiro, Brazil; Rosseti, I., Institute of Computing, Federal Fluminense University, Niterói, 24210-240 Rio de Janeiro, Brazil; Plastino, A., Institute of Computing, Federal Fluminense University, Niterói, 24210-240 Rio de Janeiro, Brazil","The incorporation of data mining techniques into metaheuristics has been efficiently adopted to solve several optimization problems. Nevertheless, we observe in the literature that this hybridization has been limited to problems in which the solutions are characterized by sets of (unordered) elements. In this work, we develop a hybrid data mining metaheuristic to solve a problem for which solutions are defined by sequences of elements. This way, we extend the domain of combinatorial optimization problems which can benefit from the combination of data mining and metaheuristic. Computational experiments showed that the proposed approach improves the pure algorithm both in the average quality of the solution and in execution time.","1-PDTSP; Data mining; GRASP; Hybrid metaheuristic","Combinatorial optimization; Heuristic algorithms; Information systems; Information use; Optimization; 1-PDTSP; Combinatorial optimization problems; Computational experiment; GRASP; Hybrid Meta-heuristic; Meta heuristics; Metaheuristic; Optimization problems; Data mining",,,"SciTePress",,9789897580277,,,"English","ICEIS - Proc. Int. Conf. Enterp. Inf. Syst.",Conference Paper,"Final",,Scopus,2-s2.0-84902357307
"Mognon F., Corte A.P.D., Sanquetta C.R., Barreto T.G., Wojciechowski J.","55675312000;15025795800;15027594400;55969375400;55777219800;","Biomass estimation for Guadua bamboo plants [Estimativas de biomassa para plantas de bambu do gênero Guadua]",2014,"Revista Ceres","61","6",,"900","906",,1,"10.1590/0034-737X201461060003","https://www.scopus.com/inward/record.uri?eid=2-s2.0-84920375026&doi=10.1590%2f0034-737X201461060003&partnerID=40&md5=2e3c991172380b5d97d350be1f148e3f","Departamento de Engenharia Florestal, Universidade Federal do Paraná, Rua Professor Lothário Meissner, 900, Curitiba, Paraná, 80.210-170, Brazil; Departamento de Ciências Florestais, Universidade Federal do Paraná, Rua Professor Lothário Meissner, 900, Curitiba, Paraná, 80.210-170, Brazil; Universidade Federal do Paraná, Rua Professor Lothário Meissner, 900, Curitiba, Paraná, 80.210-170, Brazil","Mognon, F., Departamento de Engenharia Florestal, Universidade Federal do Paraná, Rua Professor Lothário Meissner, 900, Curitiba, Paraná, 80.210-170, Brazil; Corte, A.P.D., Departamento de Ciências Florestais, Universidade Federal do Paraná, Rua Professor Lothário Meissner, 900, Curitiba, Paraná, 80.210-170, Brazil; Sanquetta, C.R., Departamento de Ciências Florestais, Universidade Federal do Paraná, Rua Professor Lothário Meissner, 900, Curitiba, Paraná, 80.210-170, Brazil; Barreto, T.G., Universidade Federal do Paraná, Rua Professor Lothário Meissner, 900, Curitiba, Paraná, 80.210-170, Brazil; Wojciechowski, J., Universidade Federal do Paraná, Rua Professor Lothário Meissner, 900, Curitiba, Paraná, 80.210-170, Brazil","The objective of this work was to fit equations for total biomass of Guadua bamboo plants and to compare adjustment of equations by linear regression with data mining technique. Thirty-eight culms of bamboo were used, in which the following variables were measured: diameter at breast height, stem diameter, stem and its height. The stems were felled and weighed by using the destructive method. The actual biomass of 25 stems was used to fit the equations by the least squares method and 13 stems were used for the validation of the best equation. The fractions of biomass per compartment differ significantly (p < 0.05) among each other. The largest fraction of the biomass corresponds to the stem, representing 69.2% of the total, followed by rhizomes, leaves and branches, with 15.7, 10.8 and 4.2%, respectively. The best fitted equation for total biomass showed a correlation coefficient of 0.93 and standard error of estimate of 15%. On the other hand, the data mining technique showed a correlation coefficient of 0.81, with a standard error of 23.8%. Biomass of Guadua bamboo can be accurately estimated either by linear regression or data mining. In this work, the regression method performed better. Data limitations can be the key factor for the poor performance of data mining technique since once it requires a larger data set to function satisfactorily.","Biomass; Correlation; Data mining; Linear regression; Poaceae","Guadua; Poaceae","Corte, A.P.D.; Engenheira Florestal, Doutora. Departamento de Ciências Florestais da Universidade Federal do Paraná, rua Professor Lothário Meissner, 900, Brazil",,"Universidade Federal de Vicosa",0034737X,,,,"Portuguese","Rev. Ceres",Article,"Final",Open Access,Scopus,2-s2.0-84920375026
"Manhães L.M.B., Da Cruz S.M.S., Zimbrão G.","8668010600;24821242900;8896320900;","The impact of high dropout rates in a large public brazilian university a quantitative approach using educational data mining",2014,"CSEDU 2014 - Proceedings of the 6th International Conference on Computer Supported Education","3",,,"124","129",,3,,"https://www.scopus.com/inward/record.uri?eid=2-s2.0-84902341731&partnerID=40&md5=06fb7155fea26e9e68745b90ea993275","PESC/COPPe - Programa de Engenharia de Sistemas e Computação, (UFRJ), Rio de Janeiro, Brazil; Programa de Pós-Graduação em Modelagem Matemática e Computacional, Seropédica, Brazil","Manhães, L.M.B., PESC/COPPe - Programa de Engenharia de Sistemas e Computação, (UFRJ), Rio de Janeiro, Brazil; Da Cruz, S.M.S., Programa de Pós-Graduação em Modelagem Matemática e Computacional, Seropédica, Brazil; Zimbrão, G., PESC/COPPe - Programa de Engenharia de Sistemas e Computação, (UFRJ), Rio de Janeiro, Brazil","This paper uses educational data mining techniques to identify the variables that can help educational managers to detect students that present low performance or are in risk to dropout their undergraduate education. We investigated real world academic data of students of the largest Public Federal Brazilian University. We established three categories of students with different academic trajectory in order to investigate their performance and the dropout rates. This study shows that even analyzing three different classes of 14.000 students it was possible to have a global precision above 80% for several classification algorithms. The results of Naïve Bayes model were used to support the quantitative analysis. In this work, we stress that even few differences between the three classes of students that can be perceived on the basis of qualitative information.","Algorithms; Data mining; Databases; Dropout rate; Educational data mining","Algorithms; Data mining; Database systems; Bayes models; Classification algorithm; Different class; Educational data mining; Qualitative information; Quantitative approach; Three categories; Undergraduate education; Students",,,"SciTePress",,,,,"English","CSEDU - Proc. Int. Conf. Comput. Supported Educ.",Conference Paper,"Final",,Scopus,2-s2.0-84902341731
"Ferreira E.L., Rausch H., Campos S., Faria-Campos A., Pietra E., Da Silva Santos L.","56494144900;56494670000;35809370100;6507115625;56495226000;56495134600;","Medical data mining: A case study of a Paracoccidioidomycosis patient's database",2014,"2014 IEEE 16th International Conference on e-Health Networking, Applications and Services, Healthcom 2014",,, 7001854,"275","280",,2,"10.1109/HealthCom.2014.7001854","https://www.scopus.com/inward/record.uri?eid=2-s2.0-84921818165&doi=10.1109%2fHealthCom.2014.7001854&partnerID=40&md5=cb69bfc04cce2f3b4ff448d3b5e0791d","Department of Computer Science, Universidade Federal de Minas Gerais, Belo Horizonte, Minas Gerais, 31270-901, Brazil; INMETRO, Xérem-Duque de Caxias, Rio de Janeiro, 25250-020, Brazil; Medical School, Universidade Federal de Minas Gerais, Belo Horizonte, Minas Gerais, 30130-100, Brazil","Ferreira, E.L., Department of Computer Science, Universidade Federal de Minas Gerais, Belo Horizonte, Minas Gerais, 31270-901, Brazil; Rausch, H., Department of Computer Science, Universidade Federal de Minas Gerais, Belo Horizonte, Minas Gerais, 31270-901, Brazil; Campos, S., Department of Computer Science, Universidade Federal de Minas Gerais, Belo Horizonte, Minas Gerais, 31270-901, Brazil; Faria-Campos, A., INMETRO, Xérem-Duque de Caxias, Rio de Janeiro, 25250-020, Brazil; Pietra, E., Medical School, Universidade Federal de Minas Gerais, Belo Horizonte, Minas Gerais, 30130-100, Brazil; Da Silva Santos, L., Medical School, Universidade Federal de Minas Gerais, Belo Horizonte, Minas Gerais, 30130-100, Brazil","Data mining applied to medical databases is a challenging process. The unavailability of large sources of data and data complexity are some of the difficulties encountered. This is especially true for rare and neglected diseases. Those databases are, in general, relatively small, wide and sparse, making them very challenging to analyze. There are also ethical, legal and social issues regarding privacy and clinical validation of the findings. This work proposes a way of dealing with this challenge with a case study of data mining applied in a Paracoccidioidomycosis (PCM) patients database. Paracoccidioidomycosis (PCM) is a typical Brazilian disease, caused by the yeast Paracoccidioides brasiliensis. This disease represents an important Public Health issue, due to its high incapacitating potential and the amount of premature deaths it causes if untreated. This paper discusses methods for the analysis of this complex dataset, to help increase the understanding of both the disease and this type of data. Despite the challenges of the dataset, some interesting findings were made being: flaws in form filling protocols, notably the lack of chest X-ray in 40% of the records; the discovery of a possible new relation between smoking habits and PCM evolution time. The average evolution time for smoking patients was 2.8 times longer; the successful classification/prediction of the cutaneous form of the disease with a 93% precision rate are some of the discoveries made. © 2014 IEEE.",,"Data mining; Database systems; Clinical validations; Data complexity; Medical data mining; Medical database; Neglected disease; Paracoccidioides brasiliensis; Precision rates; Public health issues; Medical computing","Ferreira, E.L.; Department of Computer Science, Universidade Federal de Minas GeraisBrazil; email: eduardoferreira@ufmg.br",,"Institute of Electrical and Electronics Engineers Inc.",,9781479966448,,,"English","IEEE Int. Conf. e-Health Netw., Appl. Serv., Healthcom",Conference Paper,"Final",,Scopus,2-s2.0-84921818165
"Lopes G.R., Leme L.A.P.P., Nunes B.P., Casanova M.A.","35519789100;23074190000;55453975600;7102125708;","RecLAK: Analysis and recommendation of interlinking datasets",2014,"CEUR Workshop Proceedings","1137",,,"","",,2,,"https://www.scopus.com/inward/record.uri?eid=2-s2.0-84924943984&partnerID=40&md5=6d4bbf479a5cd196df112a4ef97274f6","Departament of Informatics, PUC-Rio, Rio-de Janeiro/RJ, Brazil; Computer Science Institute, UFF, Niterói/RJ, Brazil","Lopes, G.R., Departament of Informatics, PUC-Rio, Rio-de Janeiro/RJ, Brazil; Leme, L.A.P.P., Computer Science Institute, UFF, Niterói/RJ, Brazil; Nunes, B.P., Departament of Informatics, PUC-Rio, Rio-de Janeiro/RJ, Brazil; Casanova, M.A., Departament of Informatics, PUC-Rio, Rio-de Janeiro/RJ, Brazil","This paper presents the RecLAK, a Web application developed for the LAK Challenge 2014. RecLAK focuses on the analysis of the LAK dataset metadata and provides recommendations of potential candidate datasets to be interlinked with the LAK dataset. RecLAK follows an approach to generate recommendations based on Bayesian classifiers and on Social Networks Analysis measures. Furthermore, RecLAK generates graph visualizations that explore the LAK dataset over other datasets in the Linked Open Data cloud. The results of the experiments contribute to the understanding and improvement of the LAK dataset. Furthermore, it can also help researchers of the fields covered by LAK dataset, such as learning analytics and educational data mining. Copyright © 2014 for the individual papers by the papers' authors.",,"Bayesian networks; Social networking (online); Bayesian classifier; Educational data mining; Graph visualization; Linked open datum; Social Networks Analysis; WEB application; Data mining",,"Yacef K.Drachsler H.","CEUR-WS",16130073,,,,"English","CEUR Workshop Proc.",Conference Paper,"Final",,Scopus,2-s2.0-84924943984
"Hruschka E.R., Jr., Hruschka E.R., Ebecken N.F.F.","57194234770;6603755329;7005224833;","Feature selection by Bayesian networks",2014,"Lecture Notes in Computer Science (including subseries Lecture Notes in Artificial Intelligence and Lecture Notes in Bioinformatics)","3060",,,"370","379",,27,"10.1007/978-3-540-24840-8_26","https://www.scopus.com/inward/record.uri?eid=2-s2.0-7444220224&doi=10.1007%2f978-3-540-24840-8_26&partnerID=40&md5=59844e68d92efd24ab6cc2afcaa7ceca","COPPE, Universidade Federal do Rio de Janeiro, Sala 100 Caixa Postal 68506, Rio de Janeiro, RJ, CEP 21945-970, Brazil; Universidade Católica de Santos (UniSantos), Rua Carvalho de Mendonça, 144, Santos, SP, CEP 11.070-906, Brazil","Hruschka, E.R., Jr., COPPE, Universidade Federal do Rio de Janeiro, Sala 100 Caixa Postal 68506, Rio de Janeiro, RJ, CEP 21945-970, Brazil; Hruschka, E.R., Universidade Católica de Santos (UniSantos), Rua Carvalho de Mendonça, 144, Santos, SP, CEP 11.070-906, Brazil; Ebecken, N.F.F., COPPE, Universidade Federal do Rio de Janeiro, Sala 100 Caixa Postal 68506, Rio de Janeiro, RJ, CEP 21945-970, Brazil","This work both describes and evaluates a Bayesian feature selection approach for classification problems. Basically, a Bayesian network is generated from a dataset, and then the Markov Blanket of the class variable is used to the feature subset selection task. The proposed methodology is illustrated by means of simulations in three datasets that are benchmarks for data mining methods: Wisconsin Breast Cancer, Mushroom and Congressional Voting Records. Three classifiers were employed to show the efficacy of the proposed method. The average classification rates obtained in the datasets formed by all features are compared to those achieved in the datasets formed by the features that belong to the Markov Blanket. The performed simulations lead to interesting results. © Springer-Verlag Berlin Heidelberg 2004.",,"Artificial intelligence; Classification (of information); Data mining; Feature extraction; Bayesian feature selections; Breast Cancer; Classification rates; Data mining methods; Feature subset selection; Markov Blankets; Voting records; WISCONSIN; Bayesian networks",,"Tawfik A.Y.Goodwin S.D.","Springer Verlag",03029743,9783540220046,,,"English","Lect. Notes Comput. Sci.",Conference Paper,"Final",,Scopus,2-s2.0-7444220224
"Ferneda E., Do Prado H.A., Cancian Sobrinho A.G., Balaniuk R.","55767374900;6603306851;55641684300;6602269604;","Using data mining in the selection process of high performance managers",2014,"International Journal of Reasoning-based Intelligent Systems","6","1-2",,"40","48",,,"10.1504/IJRIS.2014.063952","https://www.scopus.com/inward/record.uri?eid=2-s2.0-84914694231&doi=10.1504%2fIJRIS.2014.063952&partnerID=40&md5=9702f7a7c8232e72a562c68b37dfdfb2","Universidade Católica de Brasília, Mestrado em Gestão Do Conhecimento e Tecnologia da Informação, SGAN 916, Módulo B, Sala A-115, Brasília, DF, 70.970-160, Brazil; Embrapa-Empresa Brasileira de Agropecuária, Brazil; Tribunal de Contas da União, Brazil","Ferneda, E., Universidade Católica de Brasília, Mestrado em Gestão Do Conhecimento e Tecnologia da Informação, SGAN 916, Módulo B, Sala A-115, Brasília, DF, 70.970-160, Brazil; Do Prado, H.A., Universidade Católica de Brasília, Mestrado em Gestão Do Conhecimento e Tecnologia da Informação, SGAN 916, Módulo B, Sala A-115, Brasília, DF, 70.970-160, Brazil, Embrapa-Empresa Brasileira de Agropecuária, Brazil; Cancian Sobrinho, A.G., Universidade Católica de Brasília, Mestrado em Gestão Do Conhecimento e Tecnologia da Informação, SGAN 916, Módulo B, Sala A-115, Brasília, DF, 70.970-160, Brazil; Balaniuk, R., Universidade Católica de Brasília, Mestrado em Gestão Do Conhecimento e Tecnologia da Informação, SGAN 916, Módulo B, Sala A-115, Brasília, DF, 70.970-160, Brazil, Tribunal de Contas da União, Brazil","The selection of high performance managers involves a significant level of subjectivity. Aiming at reducing this subjectivity and mitigating possible losses, many approaches have been proposed to select the candidates that best fit into a given position. However, defining what are the most important features for a good personnel performance is still a problem. This paper details the ideas and results presented in two previous works that describe an approach, based on data mining techniques, to help managers in this process. A classifier, built over the combinatorial neural model (CNM), is described that takes as dependent variable the performance of managers as observed along their careers. As independent variables, we considered the results of well-known psychological tests (MBTI and DISC). The rules generated correlate psychological profiles of novice managers and the quality of their work after some years. These results enable a better management of people selection and allocation. Copyright © 2014 Inderscience Enterprises Ltd.","CNM; Combinatorial neural model; Knowledge-based systems","Knowledge based systems; Managers; Best fit; Dependent variables; Important features; Independent variables; Neural modeling; Psychological tests; Data mining","Ferneda, E.; Universidade Católica de Brasília, Mestrado em Gestão Do Conhecimento e Tecnologia da Informação, SGAN 916, Módulo B, Sala A-115, Brazil",,"Inderscience Publishers",17550556,,,,"English",,Article,"Final",,Scopus,2-s2.0-84914694231
