"Turra C., Dias de Lima M., Fernandes E.A.D.N., Bacchi M.A., Barbosa F., Jr., Barbosa R.","12645288300;57200648810;6602421058;7005251862;55567258200;8938657100;","Multielement determination in orange juice by ICP-MS associated with data mining for the classification of organic samples",2017,"Information Processing in Agriculture","4","3",,"199","205",,6,"10.1016/j.inpa.2017.05.004","https://www.scopus.com/inward/record.uri?eid=2-s2.0-85020378710&doi=10.1016%2fj.inpa.2017.05.004&partnerID=40&md5=780acb984e07fddf7a469926c6b45dc2","USP – Ribeirão Preto, Brazil; Instituto de Informática, Universidade Federal de Goiás, Goiânia, GO, Brazil; Instituto Federal de Educação Ciência e Tecnologia de Goiás, Goiânia, GO, Brazil; Centro de Energia Nuclear na Agricultura, Universidade de São Paulo, Piracicaba, Brazil","Turra, C., Centro de Energia Nuclear na Agricultura, Universidade de São Paulo, Piracicaba, Brazil; Dias de Lima, M., Instituto de Informática, Universidade Federal de Goiás, Goiânia, GO, Brazil, Instituto Federal de Educação Ciência e Tecnologia de Goiás, Goiânia, GO, Brazil; Fernandes, E.A.D.N., Centro de Energia Nuclear na Agricultura, Universidade de São Paulo, Piracicaba, Brazil; Bacchi, M.A., Centro de Energia Nuclear na Agricultura, Universidade de São Paulo, Piracicaba, Brazil; Barbosa, F., Jr., USP – Ribeirão Preto, Brazil; Barbosa, R., Instituto de Informática, Universidade Federal de Goiás, Goiânia, GO, Brazil","The aim of this study was to discriminate organic from conventional orange juice based on chemical elements and data mining applications. A comprehensive sampling of organic and conventional oranges was carried out in Borborema, state of São Paulo, Brazil. The fruits of the variety Valencia (Citrus sinensis (L.) Osbeck) budded on Rangpur lime (Citrus limonia Osbeck) were analyzed. Eleven chemical elements were determined in 57 orange samples grown in organic and conventional systems. In order to classify these samples, data mining techniques (Support Vector Machine (SVM) and Multilayer Perceptron (MLP)) were combined with feature selection (F-score and chi-squared). SVM with chi-squared had a better performance compared with the other techniques because it reached 93.00% accuracy using only seven chemical components (Cu, Cs, Zn, Al, Mn, Rb and Sr), and correctly classified 96.73% of the samples grown in an organic system. © 2017 China Agricultural University","Data mining; Inductively coupled plasma mass spectrometry (ICP-MS); Multilayer perceptron; Orange juice; Support vector machines; Trace elements","Chemical elements; Citrus fruits; Classification (of information); Fruit juices; Inductively coupled plasma mass spectrometry; Manganese; Mass spectrometers; Mass spectrometry; Multilayer neural networks; Multilayers; Support vector machines; Trace elements; Chemical component; Conventional systems; Data mining applications; Inductively coupled plasma mass spectrometries (ICPMS); Multi layer perceptron; Multielement determination; Orange juice; Organic systems; Data mining; artificial neural network; classification; data mining; fruit; inductively coupled plasma method; mass spectrometry; support vector machine; trace element","Barbosa, R.; Instituto de Informática (INF) – Universidade Federal de Goiás, Alameda Palmeiras, Quadra D, Câmpus Samambaia, CEP 74690-900, Brazil; email: rmbweb@gmail.com",,"China Agricultural University",22143173,,,,"English","Inf. Process. Agric.",Article,"Final",Open Access,Scopus,2-s2.0-85020378710
"Caiuta R., Pozo A., Vergilio S.R.","25649267000;13404845400;6506290092;","Meta-learning based selection of software reliability models",2017,"Automated Software Engineering","24","3",,"575","602",,1,"10.1007/s10515-016-0195-9","https://www.scopus.com/inward/record.uri?eid=2-s2.0-84961782172&doi=10.1007%2fs10515-016-0195-9&partnerID=40&md5=54eed2f4fbe35fc6991a54efc036da89","Computer Science Department, Federal University of Paraná (UFPR), CP 19:081, Curitiba, CEP: 81531-970, Brazil","Caiuta, R., Computer Science Department, Federal University of Paraná (UFPR), CP 19:081, Curitiba, CEP: 81531-970, Brazil; Pozo, A., Computer Science Department, Federal University of Paraná (UFPR), CP 19:081, Curitiba, CEP: 81531-970, Brazil; Vergilio, S.R., Computer Science Department, Federal University of Paraná (UFPR), CP 19:081, Curitiba, CEP: 81531-970, Brazil","The correct estimation of the software reliability level is fundamental to reduce efforts in the testing, maintenance and release activities. To help in this task, we find in the literature an increasing number of software reliability models (SRMs). However, none has proved to perform well considering different contexts. Due to this, the selection of the best model for a particular case is an important task. Most existing works on SRM selection need to test different models and decide based on how well the model fits the data and predicts the future events. Moreover, in general, they do not consider search-based models. Considering this fact, this paper introduces a Meta-learning approach for SRM selection. In such approach, some meta-features are used to indicate the best performing model. The approach is independent of the type of models to be selected, and can be used with different data mining algorithms. It includes the following activities: meta-knowledge extraction, meta-learning and classification. The activities meta-knowledge extraction and meta-learning are performed just once and generate a meta-classifier. Therefore, the meta-classifier is used to select the most adequate model for new projects (classification activity). The approach is evaluated in a set of experiments and the results do not show statistical difference between the Meta-learning approach and the choice of the best performing model. Otherwise, the results point out statistical difference between the Meta-learning approach and the choice of the worst performing model with a large stochastic difference according to the Vargha and Delaney Effect Size. © 2016, Springer Science+Business Media New York.","Data mining; Meta-learning; Software reliability models","Algorithms; Data mining; Extraction; Reliability; Software testing; Stochastic models; Stochastic systems; Adequate models; Data mining algorithm; Meta-classifiers; Meta-learning approach; Metalearning; Selection of software; Software reliability models; Statistical differences; Software reliability","Vergilio, S.R.; Computer Science Department, Federal University of Paraná (UFPR), CP 19:081, Brazil; email: silvia@inf.ufpr.br",,"Springer New York LLC",09288910,,ASOEE,,"English","Autom Software Eng",Article,"Final",,Scopus,2-s2.0-84961782172
"Thomaz G.M., Biz A.A., Bettoni E.M., Mendes-Filho L., Buhalis D.","57192903874;55612187200;56218213100;54892018500;6603014980;","Content mining framework in social media: A FIFA world cup 2014 case analysis",2017,"Information and Management","54","6",,"786","801",,16,"10.1016/j.im.2016.11.005","https://www.scopus.com/inward/record.uri?eid=2-s2.0-85008882710&doi=10.1016%2fj.im.2016.11.005&partnerID=40&md5=e7cb988eedfb03caa02c696cd4b15bf4","SEBRAE/CNPq, Rua Jose Felipe Antonio, 303, ap. 52, bl. 5, Jardim Vivendas, São José do Rio PretoSP  15090-430, Brazil; Universidade Federal do Paraná (UFPR), Departamento de Turismo, Rua Dr. Faivre 405, 3° andar, Ed. Dom Pedro II, Centro, CuritibaPR  80060-140, Brazil; Observatórios do Sistema Fiep, Sistema Federação das Indústrias do Estado do Paraná, Av. Com. Franco, 1341, Jardim Botânico, CuritibaPR  80215-090, Brazil; Universidade Federal do Rio Grande do Norte (UFRN), Departamento de Turismo, Av. Senador Salgado Filho, 3000, NatalRN  59072-970, Brazil; Faculty of Management, Bournemouth University D202, Talbot Campus Poole, Dorset, BH12 5BB, United Kingdom","Thomaz, G.M., SEBRAE/CNPq, Rua Jose Felipe Antonio, 303, ap. 52, bl. 5, Jardim Vivendas, São José do Rio PretoSP  15090-430, Brazil; Biz, A.A., Universidade Federal do Paraná (UFPR), Departamento de Turismo, Rua Dr. Faivre 405, 3° andar, Ed. Dom Pedro II, Centro, CuritibaPR  80060-140, Brazil; Bettoni, E.M., Observatórios do Sistema Fiep, Sistema Federação das Indústrias do Estado do Paraná, Av. Com. Franco, 1341, Jardim Botânico, CuritibaPR  80215-090, Brazil; Mendes-Filho, L., Universidade Federal do Rio Grande do Norte (UFRN), Departamento de Turismo, Av. Senador Salgado Filho, 3000, NatalRN  59072-970, Brazil; Buhalis, D., Faculty of Management, Bournemouth University D202, Talbot Campus Poole, Dorset, BH12 5BB, United Kingdom","This paper proposes a social media content mining framework that consists of seven phases. The framework was tested empirically during the FIFA World Cup 2014 at Curitiba (Brazil) as one of the main host city destinations. The research focused on the mining of Twitter content with tourist services ontology (hospitality, food and beverages, and transportation). In total, 58,686 valid messages were collected, analyzed, and associated with an application ontology. Content analysis demonstrated an accurate real-time reflection of tourism services. The framework is effective to collect relevant content and identify popular topics in social media toward strategic and operational tourism management. © 2016 Elsevier B.V.","Brazil; Content mining; FIFA world cup 2014; Social media; Tourist services; Twitter","Data mining; Ontology; Brazil; Content mining; Social media; Tourist services; Twitter; World cup; Social networking (online)","Mendes-Filho, L.; Universidade Federal do Rio Grande do Norte (UFRN), Departamento de Turismo, Av. Senador Salgado Filho, 3000, Natal, Brazil; email: luiz.mendesfilho@gmail.com",,"Elsevier B.V.",03787206,,IMAND,,"English","Inf Manage",Article,"Final",,Scopus,2-s2.0-85008882710
"Santos C.G.R., Araújo T.D.O., Chagas P.R., Jr., Neto N.C.S., Meiguins B.S.","35180344300;57125731200;57191849627;57190942593;6506654143;","Recognizing and exploring azulejos on historic buildings' facades by combining computer vision and geolocation in mobile augmented reality applications",2017,"Journal of Mobile Multimedia","13","1-2",,"57","74",,2,,"https://www.scopus.com/inward/record.uri?eid=2-s2.0-85038917199&partnerID=40&md5=233f12d0379ac37485d97b8a4199e54c","Universidade Federal do Pará, Brazil","Santos, C.G.R., Universidade Federal do Pará, Brazil; Araújo, T.D.O., Universidade Federal do Pará, Brazil; Chagas, P.R., Jr., Universidade Federal do Pará, Brazil; Neto, N.C.S., Universidade Federal do Pará, Brazil; Meiguins, B.S., Universidade Federal do Pará, Brazil","Mobile augmented reality (MAR) applications assist users in navigating and exploring their actual surroundings, displaying virtual contents that correspond to objects and scenes in the real world. However, despite the growing popularity of these applications, some experiences can be frustrating when users are unable to correctly recognize Points of Interest (POI), objects, or places they want to visit or obtain more information. The misleading recognition can occur due to imprecise Global Positioning System (GPS) data or a lack of QR codes for interaction. Hence, this article presents a proposal that combines pattern recognition in images with geolocation information to improve the accuracy of the identification of POIs. The usage scenario is the identification of azulejos (tiles) on the facades of historic buildings in the city of Belém of Pará, Brazil. This issue is relevant based on similarities between azulejos and its huge amount of different types, whose variety of designs and colors of geometric forms can make the identification a hard task. The used methods to extract the azulejos' features were the co-occurrence matrix combined with color percentage, and the global positioning data to increase the accuracy of classification because similar azulejos can be geographically far apart. Tests were conducted using six machine learning algorithms (neural network, decision tree, k-nearest neighbors, naive Bayes, random forest, and support vector machine) of different paradigms. The first results show that the pattern recognition in images combined with geolocation information is a promising approach for better identification of the POIs in MAR applications. © Rinton Press.","Azulejos; Image Recognition; Machine Learning Algorithms; Mobile Augmented Reality","Artificial intelligence; Augmented reality; Building materials; Buildings; Computer vision; Data mining; Decision trees; Global positioning system; Image enhancement; Image processing; Image recognition; Learning systems; Nearest neighbor search; Pattern recognition; Accuracy of classifications; Azulejos; Co-occurrence-matrix; Global positioning; Historic buildings; K-nearest neighbors; Mobile augmented reality; Points of Interest(POI); Learning algorithms",,,"Rinton Press Inc.",15504646,,,,"English","J.Mob. Multimedia",Article,"Final",,Scopus,2-s2.0-85038917199
"Figueiredo L.N.L., de Assis G.T., Ferreira A.A.","56494420200;23388585700;7402999591;","DERIN: A data extraction method based on rendering information and n-gram",2017,"Information Processing and Management","53","5",,"1120","1138",,8,"10.1016/j.ipm.2017.04.007","https://www.scopus.com/inward/record.uri?eid=2-s2.0-85019118156&doi=10.1016%2fj.ipm.2017.04.007&partnerID=40&md5=b3d27bfa45f759ca14dd68570604e1a5","Departamento de Computação, Universidade Federal de Ouro Preto, Campus Universitário Morro do Cruzeiro, CEP 35400-000, Ouro Preto - MG, Brazil","Figueiredo, L.N.L., Departamento de Computação, Universidade Federal de Ouro Preto, Campus Universitário Morro do Cruzeiro, CEP 35400-000, Ouro Preto - MG, Brazil; de Assis, G.T., Departamento de Computação, Universidade Federal de Ouro Preto, Campus Universitário Morro do Cruzeiro, CEP 35400-000, Ouro Preto - MG, Brazil; Ferreira, A.A., Departamento de Computação, Universidade Federal de Ouro Preto, Campus Universitário Morro do Cruzeiro, CEP 35400-000, Ouro Preto - MG, Brazil","Extracting data from web pages is an important task for several applications such as comparison shopping and data mining. Ordinarily, the data in web pages represent records from a database and are obtained using a web search. One of the most important steps for extracting records from a web page is identifying out of the different data regions, the one containing the records to be extracted. An incorrect identification of this region may lead to an extraction of incorrect records. This process is followed by the equally important step of detecting and correctly splitting the necessary records and their attributes from the main data region. In this study, we propose a method for data extraction based on rendering information and an n-gram model (DERIN) that aims to improve wrapper performance by automatically selecting the main data region from a search results page and extracting its records and attributes based on rendering information. The proposed DERIN method can detect different record structures using techniques based on an n-gram model. Moreover, DERIN does not require examples to learn how to extract the data, performs a given domain independently and can detect records that are not children of the same parent element in the DOM tree. Experimental results using web pages from several domains show that DERIN is highly effective and performs well when compared with other methods. © 2017 Elsevier Ltd","Data extraction; Main data region; N-gram; Path expression; Rendering information; Visual information; Wrapper","Extraction; Trees (mathematics); Websites; Data extraction; Data regions; N-grams; Path expressions; Rendering information; Visual information; Wrapper; Data mining","Ferreira, A.A.email: ferreira@iceb.ufop.br",,"Elsevier Ltd",03064573,,IPMAD,,"English","Inf. Process. Manage.",Article,"Final",,Scopus,2-s2.0-85019118156
"Silva G.R.L., De Oliveira L.M., De Medeiros R.R., Goussevskaia O., Benevenuto F.","57196027241;57196023045;57196018964;10046405700;8559211800;","Characterizing internet radio stations at scale",2017,"Proceedings - 2017 IEEE/WIC/ACM International Conference on Web Intelligence, WI 2017",,,,"670","677",,,"10.1145/3106426.3106540","https://www.scopus.com/inward/record.uri?eid=2-s2.0-85031025849&doi=10.1145%2f3106426.3106540&partnerID=40&md5=c91b472b1af66e7c201990c787ded3ae","Electrical Engineering Department, Universidade Federal de Minas Gerais, Belo Horizonte, Brazil; Computer Science Department, Universidade Federal de Minas Gerais, Belo Horizonte, Brazil","Silva, G.R.L., Electrical Engineering Department, Universidade Federal de Minas Gerais, Belo Horizonte, Brazil; De Oliveira, L.M., Computer Science Department, Universidade Federal de Minas Gerais, Belo Horizonte, Brazil; De Medeiros, R.R., Computer Science Department, Universidade Federal de Minas Gerais, Belo Horizonte, Brazil; Goussevskaia, O., Computer Science Department, Universidade Federal de Minas Gerais, Belo Horizonte, Brazil; Benevenuto, F., Computer Science Department, Universidade Federal de Minas Gerais, Belo Horizonte, Brazil","In this paper we build and characterize a large-scale dataset of internet radio streams. More than 25 million snapshots of more than 75 thousand different radio stations were collected from the SHOUTcast service between December 2016 and April 2017. We characterized several attributes of the dataset, such as audience and music genre distributions among radio stations, advertisement and seasonal content dynamics, as well as bit rates and media formats of the radio streams. Finally, we analyzed to which extent these features affect audience size. We hope these and the other findings of our study may provide valuable information for content personalization and better advertisement placement in internet radio streams. © 2017 ACM.","Internet radio characterization; Internet radio streams; Multimedia data mining; Radio popularity; Web content mining","Data mining; Radio stations; Bit rates; Content personalization; Internet radio; Large-scale dataset; Media formats; Multimedia data mining; Music genre; Web content mining; Internet",,,"Association for Computing Machinery, Inc",,9781450349512,,,"English","Proc. - IEEE/WIC/ACM Int. Conf. Web Intell., WI",Conference Paper,"Final",,Scopus,2-s2.0-85031025849
"Cirqueira D., Pinheiro M., Braga T., Jacob A., Reinhold O., Alt R., Santana Á.","55920387200;57193070818;57214982627;55926177300;55490710800;56267296300;15072137400;","Improving relationship management in universities with sentiment analysis and topic modeling of social media channels: Learnings from UFPA",2017,"Proceedings - 2017 IEEE/WIC/ACM International Conference on Web Intelligence, WI 2017",,,,"998","1005",,2,"10.1145/3106426.3117761","https://www.scopus.com/inward/record.uri?eid=2-s2.0-85031036283&doi=10.1145%2f3106426.3117761&partnerID=40&md5=f867922106b27ec9ee72733072e763cf","Federal University of Pará, Belém, Pará, Brazil; State University of Maranhão, São Luís, Maranhão, Brazil; Leipzig University, Leipzig, Saxony, Germany","Cirqueira, D., Federal University of Pará, Belém, Pará, Brazil; Pinheiro, M., Federal University of Pará, Belém, Pará, Brazil; Braga, T., Federal University of Pará, Belém, Pará, Brazil; Jacob, A., State University of Maranhão, São Luís, Maranhão, Brazil; Reinhold, O., Leipzig University, Leipzig, Saxony, Germany; Alt, R., Leipzig University, Leipzig, Saxony, Germany; Santana, Á., Federal University of Pará, Belém, Pará, Brazil","Online Social networking (OSN) platforms such as Facebook, daily have a massive number of users and content being created. Users of such services have the power to share opinions and influence others. This creates an interesting scenario, where brands and institutions can have a digital presence to interact directly with their target audience. Universities around the world are also using those platforms for reaching out their students and staff, acting as a new channel for services and public relations. Social Customer Relationship Management (SCRM) principles can be applied in this scenario, for universities, and help them on the management of this relationship with their public. Thus, this work aims to apply SCRM methodology for a university Facebook fan page, through techniques of Sentiment Analysis (SA) and topic modeling (TM) using Latent Dirichlet Allocation, in order to find topics people are complimenting or complaining about in their comments. The main goal is to improve SCRM processes through the results and insights provided by those techniques. The final discussion with the communications professionals from UFPA university has revealed the experiments and insights provided in this work are valuable for their social media (SM) management workflow. © 2017 ACM.","Lda; Scrm; Sentiment analysis; Social crm; Topic modeling","Data mining; Education; Public relations; Societies and institutions; Statistics; Customer relationship management; Latent Dirichlet allocation; Online social networkings (OSN); Relationship management; Scrm; Sentiment analysis; Social crm; Topic Modeling; Social networking (online)",,,"Association for Computing Machinery, Inc",,9781450349512,,,"English","Proc. - IEEE/WIC/ACM Int. Conf. Web Intell., WI",Conference Paper,"Final",,Scopus,2-s2.0-85031036283
"Brandão M.A., Vaz De Melo P.O.S., Moro M.M.","55556935900;36563125900;7102336257;","Tie strength dynamics over temporal co-Authorship social networks",2017,"Proceedings - 2017 IEEE/WIC/ACM International Conference on Web Intelligence, WI 2017",,,,"306","313",,2,"10.1145/3106426.3106536","https://www.scopus.com/inward/record.uri?eid=2-s2.0-85030984407&doi=10.1145%2f3106426.3106536&partnerID=40&md5=4a205f07bf515199c5ce0af69fc1b802","Universidade Federal de Minas Gerais, Belo Horizonte, Brazil","Brandão, M.A., Universidade Federal de Minas Gerais, Belo Horizonte, Brazil; Vaz De Melo, P.O.S., Universidade Federal de Minas Gerais, Belo Horizonte, Brazil; Moro, M.M., Universidade Federal de Minas Gerais, Belo Horizonte, Brazil","In co-Authorship social networks, nodes are authors linked by coauthorship interactions. As time is a relevant aspect of such interactions, concepts and metrics designed to static networks have to be adapted to temporal networks. Tie strength is one of those concepts. Here, we verify if current tie strength definitions are valid for temporal networks by analyzing the strength of ties dynamism over temporal co-Authorship networks. Surprisingly, our results show that most ties, even the strong ones, tend to perish over time,us, most co-Authorships are symbiotic without positive concerns. Also, real co-Authorship social networks from di.erent research areas have more weak and random ties than strong and bridge ties. © 2017 ACM.","Data and graph mining; Temporal social networks analyses; Tie strength","Data mining; Publishing; Co-authorship networks; Co-authorships; Graph mining; Social Networks Analysis; Static networks; Strength of ties; Temporal networks; Tie strengths; Social networking (online)",,,"Association for Computing Machinery, Inc",,9781450349512,,,"English","Proc. - IEEE/WIC/ACM Int. Conf. Web Intell., WI",Conference Paper,"Final",,Scopus,2-s2.0-85030984407
"Neto J.A.M., Yokoyama K.M., Becker K.","57193056790;57196016930;7401802524;","Studying toxic behavior influence and player chat in an online video game",2017,"Proceedings - 2017 IEEE/WIC/ACM International Conference on Web Intelligence, WI 2017",,,,"26","33",,4,"10.1145/3106426.3106452","https://www.scopus.com/inward/record.uri?eid=2-s2.0-85031020240&doi=10.1145%2f3106426.3106452&partnerID=40&md5=bc0c84fefa8e422a14f5e17302fdbdfd","Instituto de Informática, Universidade Federal do, Rio Grande do Sul, Porto Alegre, Brazil","Neto, J.A.M., Instituto de Informática, Universidade Federal do, Rio Grande do Sul, Porto Alegre, Brazil; Yokoyama, K.M., Instituto de Informática, Universidade Federal do, Rio Grande do Sul, Porto Alegre, Brazil; Becker, K., Instituto de Informática, Universidade Federal do, Rio Grande do Sul, Porto Alegre, Brazil","Many online collaborative games, e-sports in particular, heavily rely on teamwork. However, players can act in an antisocial way during the match, creating dissent into the match. This kind of behavior is referred to as toxic. We aim to discover the influence brought by toxic behavior in a popular e-sport, League of Legends, through the study of communication patterns of players during the match. We discovered that different communication patterns exist, and that they are directly related to player performance and level of toxic behavior. We also propose metrics to analyze players' performance and the toxic contamination level, which measures the negative impacts of the toxic behavior. Our analysis contributes to shed light on how players behave in an online game, and opens ways to provide a better ambience on the online video game community. © 2017 ACM.","League of legends; Online games; Text mining; Toxic behavior","Data mining; Interactive computer graphics; Social networking (online); Sports; Collaborative games; Communication pattern; Contamination levels; League of legends; On-line games; Online video; Text mining; Toxic behavior; Human computer interaction",,,"Association for Computing Machinery, Inc",,9781450349512,,,"English","Proc. - IEEE/WIC/ACM Int. Conf. Web Intell., WI",Conference Paper,"Final",,Scopus,2-s2.0-85031020240
